name,rating,type_of,price,comments
"Mighty Mint Gallon (128 oz) Insect & Pest Control Peppermint Oil Spray for Spiders, Ants, and More",4.4682,Insect & Pest Repellent,35.98,"This product does not work very good. I had a problem with ants and I sprayed the ants, but the ants kept coming back.  I did this for a week,  over a period of several hours a day. I finally got a different type of ant killer and now my ant problem is gone. I was very disappointed with this product and I will not buy it again. a waste of money"
Marvel Spider-Man Glow FX Mask Electronic Wearable Toy With Light-Up Eyes For Role Play,4.2083,Action Figures,36.98,"This is hard molded plastic. I assumed it would have some sort of padding on the inside, but it doesn't. I can't imagine that a child could wear this for more than a minute without it hurting. The mask itself works fine, with a lever to open/close the eyes and activate the lights that only last a few seconds. I definitely wouldn't recommend this.  I plan to return it and search for a soft version."
LEGO Marvel Spider-Man: Spider-Man and Ghost Rider vs. Carnage 76173 Collectible Building Toy (212 Pieces),4.8824,Interlocking Block Building Sets,44.95,
Marvel's Spider-Man: Miles Morales - PlayStation 4,4.578,Video Games,43.98,"The order was shipped and delivered within a day HOWEVER the package was delivered wrapped in a Walmart plastic bag with sticker! This is absolutely unacceptable. This was a gift and wasn't properly packaged, someone could've easily identify the gift and taken it! Also the picture that was emailed to me was NOT visible."
Spider-Man Trilogy (4K Ultra HD + Digital Copy),3,Movies,45.55,
"Squishmallows 14"" Marvel Spider-Man Stuffed Plush",5,Stuffed Animals & Plush Toys,50.9,
"Marvel Ultimate Protectors Figure, 8 Pack",4.6944,Action Figures,46.95,they have them at kroger for 27.99
"Marvel Spidey and His Amazing Friends Web-Quarters Action Figure Set, 3 Pieces",4.0476,Action Figure Sets,52.65,The toy is so cheaply made. The spider “legs” don't move so the car can't even slide down them. It just falls off. The toy was almost $60 and is so cheap and just flimsy plastic. I'd pay maybe $20 for this after seeing it in person
LEGO Marvel Avengers Venom Crawler 76163 Spider-Man vs Venom Mech Playset (413 Pieces),4.6136,Interlocking Block Building Sets,62.99,This toy was returned for the box being damaged. The next day I receive the same damaged box. A four year old will not understand why his Papa got him a damaged box for his birthday. Not a great way to show my love to him. I thought that if I returned it to a store they would send me a new box not the same box. I shouldn't even have to pay for this.
LEGO Marvel Spider-Man: Spider-Man's Monster Truck vs. Mysterio 76174; Cool Construction Toy (439 Pieces),4.9063,Interlocking Block Building Sets,73.98,
The Very Hungry Caterpillar (Board book),4.6602,Books,4.93,This is a small board book
Spidey and His Amazing Friends Hero Reveal 2-Pack Miles Morales: Spider-Man and Hulk,4.6538,Action Figures,9.88,the miles is broken after a week. he just fell apart
Way to Celebrate Halloween Black Sound and Motion Activated Dropping Spider Decoration,3.1765,Decoration,14.97,"Bought one and the string broke after the spider was hung up and activated 3 times. Figured it was a fluke, so bought a second one. Hung the new one up but kept it off for a few days just to be sure this one was sturdier than my previous one. Turned it on after 5 days of hanging just fine and the string snapped almost immediately as the spider started to descend. There is no way to reattach the hoop to the string that's inside the spider so they are both paperweights now. The string is LITERALLY about as thick as a strand of hair. So, save your money and buy a different brand if you're looking for something like this. The only positive I can say, is that the sound it made was clear, easy to hear, and kinda cool."
"Mighty Mint 16oz Insect & Pest Control Peppermint Oil Spray - Killer & Repellent for Spiders, Ants, Flies, and More",4.5216,Insect & Pest Repellent,18.99,"I really don't like to give a review that's not 100% honest 
because I sometimes base the products I purchase by 
reading feedback first! I wanted so bad to like this product 
because I love smelling mint. This spray is just too much 
of a mint smell to use inside. It's very overwhelming so
I thought maybe that's what would get rid of the spiders
and bugs. It just didn't seem to be killing the bugs so I 
thought maybe it just repells them. The smell maybe keeps 
them away.
The Mighty mint smells so strong that my dog hides
when she see me bring the bottle out! I am not a fan of 
this product and I think I would purchase it!"
"Plastic Spiderman Favor Bags, 8ct",2.5,Party Bags,1.47,
"Marvel Spiderman Multi-Color Stamper Party Favor, 4 Count",1.7143,Party Favors,1.52,"These stamps were horrible…got them for my 3 yr old son and 2 of them don't work at all and the other 2 are very hard to see. Needles to say, my son was kinda upset they don't work."
Skeleton Bat Prop Halloween Decoration,4.7,Decoration,2.98,It was much smaller than I thought it would be. Pretty pricey for what I got.
You're My Little: You're My Little Cuddle Bug (Board book),4.7,Books,4.76,It's a cute book. Fairly cheap price. Unfortunately mine came damaged
The Very Hungry Caterpillar (Board book),4.6602,Books,4.93,This is a small board book
"Raid Insect Killer, House & Garden I, 11 oz",4.4773,"Pest Bait, Traps & Killers",5.35,Doesn't seem to kill anything...just makes them flee
The Amazing Spider-Man 2 (Blu-ray + DVD),2.3333,Movies,7.35,
The Amazing Spider-Man (Blu-ray + DVD),4.7059,Movies,8.05,
5-Minute Spider-Man Stories (Hardcover),5,Books,9.39,
"White Stretch Spider Web Halloween Decoration by Fun World, 200 sq ft",3.6429,Decoration,9.47,
"Ortho Home Defense Max Ant, Roach and Spider, Kills Ants, Beetles, Cockroaches, 14 Ounce",,"Pest Bait, Traps & Killers",10.8,
"Spider-Man and Friends Baby and Toddler Boys' Blanket Sleeper, Sizes 12M-5T",,Pajamas,10.98,
"Hot Shot Spider and Scorpion Killer Aerosol, 11 Ounce",,"Pest Bait, Traps & Killers",12.45,
Marvel Spidey and His Amazing Friends Supersized Miles Morales: Spider-Man Action Figure,4.7917,Action Figures,10.99,
Marvel Spidey and His Amazing Friends Supersized Ghost-Spider Action Figure,4.8261,Action Figures,12.88,
Way to Celebrate Halloween Black Sound and Motion Activated Dropping Spider Decoration,3.1765,Decoration,14.97,"Bought one and the string broke after the spider was hung up and activated 3 times. Figured it was a fluke, so bought a second one. Hung the new one up but kept it off for a few days just to be sure this one was sturdier than my previous one. Turned it on after 5 days of hanging just fine and the string snapped almost immediately as the spider started to descend. There is no way to reattach the hoop to the string that's inside the spider so they are both paperweights now. The string is LITERALLY about as thick as a strand of hair. So, save your money and buy a different brand if you're looking for something like this. The only positive I can say, is that the sound it made was clear, easy to hear, and kinda cool."
"Heroes Of Goo Jit Zu Marvel Hero, The Amazing Spider-Man - Squishy, 4.5"" Tall, Boys, Ages 4+",4.7083,Action Figures,12.93,"I overall did not care for the Marvel Heros Goo Jit Zu Spider Man. The first thing I noticed is that the eyes were completely different sizes.  I expected the figure to be super stretchy which he was,  however seeing the water beads was not really achievable at all.  I would not get this again."
"Spider-Man Boys Long Sleeve Top and Pants Pajama Sleep Set, 2-Piece, Sizes 4-12",3.2,Pajamas,16.99,
Harris Spider Killer 32oz Ready to Use Trigger Spray,3,"Pest Bait, Traps & Killers",16.49,
"Ortho Home Defense Insect Killer for Indoor & Perimeter2 Ready-To-Use - With Trigger Sprayer, Long-Lasting Control, Kills Ants, Cockroaches, Spiders, Fleas & Ticks, Non-Staining, Odor Free, 1 gal.",,"Pest Bait, Traps & Killers",16.77,
"Hot Shot Ant, Roach & Spider Killer 2-17.5 Ounce, Fresh Floral Scent, Twin Pack",,"Pest Bait, Traps & Killers",20.85,
Marvel Super Hero Adventures Mega Mighties Spider-Man 10-inch Action Figure,4.8936,Action Figures,18.96,
"Mighty Mint 16oz Insect & Pest Control Peppermint Oil Spray - Killer & Repellent for Spiders, Ants, Flies, and More",4.5216,Insect & Pest Repellent,18.99,"I really don't like to give a review that's not 100% honest 
because I sometimes base the products I purchase by 
reading feedback first! I wanted so bad to like this product 
because I love smelling mint. This spray is just too much 
of a mint smell to use inside. It's very overwhelming so
I thought maybe that's what would get rid of the spiders
and bugs. It just didn't seem to be killing the bugs so I 
thought maybe it just repells them. The smell maybe keeps 
them away.
The Mighty mint smells so strong that my dog hides
when she see me bring the bottle out! I am not a fan of 
this product and I think I would purchase it!"
"Spiderman Toddler Boys Pajama Blanket Sleeper, 2-Pack, Sizes 3T-5T",4.5455,Pajamas,19.96,
"Marvel Spider-Man: Across the Spider-Verse Miles Morales Tri-Shot NERF Blaster, 3 Darts",4.8,Action Figures,17.99,
Terro 16 oz. Spider Killer Aerosol Spray - 2 Spray Bottles T2302-2,5,"Pest Bait, Traps & Killers",21.99,
"Spider-Man Baby & Toddler Boys Blanket Sleeper, Sizes 12M-5T",4.9091,Pajamas,21.75,
Spider-Man Triple Feature (Spider-Man: Far from Home / Spider-Man: Homecoming / Spider-Man: No Way Home)(Walmart Exclusive)(Blu-ray) Exclusive Slip Cover Art,,Movies,23.39,
"Child Officially Licensed Boy Marvel Deluxe Light Up Iron Spider Halloween Costume Small, Red, Gold and Black",3.6667,Fancy-Dress Costumes,24.97,
Marvel Mech Strike Monster Hunters Titan Hero Series Hunter Suit Spider-Man Action Figure,4.8333,Action Figures,24.97,
"Child Officially Licensed Boy Marvel Deluxe Light Up Iron Spider Halloween Costume Small, Red, Gold and Black",2,Fancy-Dress Costumes,24.97,
Marvel Mech Strike Monster Hunters Titan Hero Series Hunter Suit Spider-Man Action Figure,10,Action Figures,24.97,Spidey fans
"Ortho 0196410 Home Defense MAX Insect Killer Spray for Indoor and Home Perimeter, 24-Ounce (Ant, Roach, Spider, Stinkbug & Centipede Killer)(2Pack)",0,"Pest Bait, Traps & Killers",26.05,
Marvel Spider-Man 6-inch Jet Web Cycle Vehicle and Action Figure Toy With Wings,19,Action Figure Sets,28.99,My son loves it!!
"Marvel Miles Morales Spiderman Boy's Halloween Fancy-Dress Costume for Child, S",25,Fancy-Dress Costumes,34.83,Awesome Costume for any Spidey Lover
Spider-Man Web Shots Spiderbolt NERF Powered Blaster Toy,41,Blasters & Foam Play,33.88,
"Temprid Ready-To-Spray Aerosol Insecticide - Kills Bed Bugs, Spiders, Fleas and More - 15 oz Can by Bayer",0,"Pest Bait, Traps & Killers",35.72,
Marvel Legends Series Integrated Suit Spider-Man Collectible Action Figure,4,Action Figures,36.79,
Spider-Man Maximum Venom Titan Hero Captain America,56,Action Figures,37.95,Super impressive
"Marvel Spider-Man Super Web Slinger, Includes Spidey Shot Web Fluid, and Gloves",170,Action Figure Accessories,19.84,WEB AND WATER SPRAYER
"Marvel’s Spider-Man: Miles Morales Ultimate Launch Edition, Sony, PlayStation 5, 3006163",582,Video Games,69.99,I've been waiting an entire YEAR for this!
"LEGO Marvel Spider-Man Spider-Jet vs Venom Mech 76150 Building Kit with Minifigures, Mech and Plane (371 Pieces)",20,Interlocking Block Building Sets,72.99,Great set
Way to Celebrate Faux Skeleton Spider Halloween Decoration,8,Decoration,5.51,Scared me!
"Black Flag Spider & Scorpion Killer Aerosol Spray, 16-Ounce",0,"Pest Bait, Traps & Killers",9,
"Hot Shot 17.5 Oz. Lemon Fresh Scent Aerosol Spray Ant, Roach, & Spider Killer HG-96782 708664",0,"Pest Bait, Traps & Killers",8.79,
"WAY TO CELEBRATE! Halloween Skeleton Ghost Hanging Decoration, White, 36""",8,Decoration,9.98,Will Make for a Spookier Halloween
Mite Killer Spray–Treatment for Dust Spider Bird Chicken Rat Mouse Carpet and Scabies Mites–Fast Acting 100% Effective-50ML,0,"Pest Bait, Traps & Killers",10.98,
Morris FW91199BK Spider Family 8 Card Black Fuzzy Halloween Decoration,0,Outdoor Decor,11.99,
Marvel Spider-Man Titan Hero Series Blast Gear Spider-Man Action Figure,19,Action Figures,11.99,Awesome Action Figure
Venom (Blu-Ray + DVD),71,Movies,12.21,Great Movie But…
Super Hero Action Figures Toys with Light Music Collectible Model Boys Toy Gifts Spider Man,0,Action Figures,14.41,
Bonide Ground Bee & Spider Killer,2,"Pest Bait, Traps & Killers",12.89,
"Bonide Pyrethrin Aphid Killer Concentrate, 8 Ounce Bottle",4,"Pest Bait, Traps & Killers",14.95,
Costume Iron Spider-Man Children'S Bodysuit Iron Spider-Man One Piece M,3,Fancy-Dress Costumes,15.98,
Spiderman Kids Freestanding Punching Bag Inflatable Vinyl Bop Boxing Kicking Dummy Gear Fitness Bag 35.5 inch Tall - Durable Heavy Duty Indoor and Outdoor Tower Bag Stress relief,19,Novelty & Gag Toys,16.88,
"Ortho 0196710 Home Defense MAX Insect Killer Spray for Indoor and Home Perimeter, 1-Gallon (Ant, Roach, Spider, Stinkbug, & Centipede Killer)",0,"Pest Bait, Traps & Killers",16.89,
"Spider-Man Boys Classic Short Sleeve Top, Pants, and Shorts, 3-Piece Pajama Set, Sizes 4-10",5,Pajamas,16.98,
"TERRO T2302 Spider Killer Spray, 2 Pack",1,"Pest Bait, Traps & Killers",17.85,
Marvel Spider-Man Bend and Flex Missions Spider-Man Space Mission Action Figure,10,Action Figures,23.35,Tons of fun !
The Amazing Spider-Man / The Amazing Spider-Man 2 (Blu-ray + Digital Copy),0,Movies,26.99,
Mighty Mint Spider Repellent & Killer Peppermint Oil Spray - 16oz,149,Insect & Pest Repellent,18.95,High grade peppermint oil...
"Spider-Man Maximum Venom Titan Hero Miles Morales Action Figure, Ages 4 and up",30,Action Figures,18.99,Great Venom toy
"Marvel Legends Series Spider-Man Hobgoblin Action Figure, Includes 3 Accessories",1,Action Figures,23.7,
"Spider-Man Verse Miles Morales Boy's Halloween Fancy-Dress Costume for Child, L",13,Fancy-Dress Costumes,35.95,
"Spider-Man Boys' Long Sleeve Pajama Set, 2-Piece, Sizes 4-12",3,Pajamas,21.78,
"Unique Industries Pull String Spider-Man Multi-color Asymmetrical Birthday Pinata, 18"" x 18""",13,Pinatas,23.5,Boys birthday celebration-Happy Mom of 2 toddlers
"Spider-Man Boys Short Sleeve Top and Pants, 2-Piece Pajama Set, Sizes 4-12",3,Pajamas,24.89,
16 Oz. Scorpion And Spider Killer Spray (3-Pack),0,"Pest Bait, Traps & Killers",25.44,
"Spider-Man Toddler Boys Coat Sleepwear, Sizes 2T-5T",7,Pajamas,25.99,Soft
Marvel Spider-Man Spider-Mobile 6-Inch-Scale Vehicle and Miles Morales Action Figure,8,Action Figures,28.97,My nephew loves this
Marvel Toys Spider-Man Bend And Flex Spider-Man Vs. Ock-Bot Action Figures,9,Action Figures,39.99,Super bendable
Marvel Legends Series Spider-Man Spider-Man: Ben Reilly Action Figure,1,Action Figures,33.99,
"Control Solutions Stryker 54 Contact Aerosol Insect Spray, 15 Ounce Can",2,"Pest Bait, Traps & Killers",44.15,
Marvel Legends Series Black & Gold Suit Spider-Man Collectible Action Figure,1,Action Figures,30.99,
"Spiderman Boys Long Sleeve Top, Pants and Robe, 3-Piece Pajama Set, Sizes 2T-5T",11,Pajamas,35.97,
Beethoven TR 2 oz (1 Count) Total Release Insecticide Miticide Aerosol Fogger Spider Mite Killer Bomb Whitefly Mites Pest Control,0,"Pest Bait, Traps & Killers",37.14,
LEGO Marvel Spider-Man: Spider-Man vs. Doc Ock 76148 Superhero Action Figure Adventure Playset Motorcycle Battle Building Toy (234 Pieces),31,Interlocking Block Building Sets,55.99,Love this!
Spider-Man Maximum Venom Venomized Iron Man Action Figure Set,50,Action Figures,19.87,MY GRANDSON LOVES THIS
Spider-Man: 3-Movie Collection (Limited Edition Collection) (4K Ultra HD + Blu-ray),3,Movies,49.99,
"Way to Celebrate Halloween Fuzzy Spiders, Black and Gray, Set of 8",0,Decoration,1.98,
"Way To Celebrate Halloween 3D Spider Confetti, 100 Count",1,Confetti,0.98,
Way To Celebrate Halloween Set of 8 Black Plastic 2.8 Inch Glitter Spiders Outdoor Decoration,4,Decoration,1.98,
Halloween Spider Decoration Haunted House Prop Indoor Outdoor Black-Giant Spider,6,Decoration,6.27,Love it!!! It looks amazing
"Halloween Giant Spider Decorations, Large Fake Spider with Straps Hairy Backpack Spider Realistic Scary Prank Props for Indoor Outdoor Yard Party Halloween Decor",4,Decoration,6.39,Favorable
"Way To Celebrate  Halloween Giant Gold Hairy Spider Décor, 50 inch",1,Decoration,7.98,
Marvel Spider-Man Titan Hero Series Spider-Man 12-Inch Super Hero,54,Action Figures,29.95,Absolutely love
The Amazing Spider-Man 2 (DVD),8,Movies,9.05,
"Marvel Ultimate Spider-man Titan Hero Series Spider-man Figure, 12-Inch",48,Action Figures,9.63,Great gift at a good cost
"Spiderman Boys Short Sleeve Top and Pants, 2-Piece Pajama Set, Sizes 4-12",0,Pajamas,10.98,
Marvel Spider-Man: Into the Spider-Verse Movie Theater Storybook (Hardcover),1,Books,11.59,
"Spider-Man Baby & Toddler Boys Pajama Set, 2-Piece, Sizes 12M-5T",0,Pajamas,16.99,
Venom (DVD),29,Movies,15.84,unexpectedly good.
Spiderman Men’s Pajama Pants,0,Pajamas,14.48,
"Child Officially Licensed Boys Marvel Iron Spider Halloween Costume Medium, Red",0,Fancy-Dress Costumes,15,
"[Spiderman Costume ] Nature Star Spider Man Costume For Kids, Children Far-From-Home Cosplay Children, Lycra Spandex Zentai Suit 3D Style Red Kids",1,Fancy-Dress Costumes,20.12,
"Spider-Man Boys Exclusive Classic Pajama Pants, 2-Pack, Sizes 4-12",2,Pajamas,16.98,
"The Avengers Boys Exclusive Long Sleeve with Long Pants Pajama Set, 2-Piece, Sizes 4-12",4,Pajamas,32.99,
Marvel Spider-Man Titan Hero Series Iron Spider Integration Suit Spider-Man,1,Action Figures,17.95,
"Ever Pest Ultrasonic Pest Control Repeller - Repel Rodents, Ants, Cockroaches, Bed Bugs, Mosquitos, Flies, Spiders & Bat",19,Insect & Pest Repellent,21.97,This is a good product!
"EcoSmart Natural, Plant-Based Spider Blaster/Killer, 9 Ounce Aerosol Spray Can (Pack of 2)",0,"Pest Bait, Traps & Killers",21.99,
"Spider-Man and Friends Exclusive Toddler Boys Cotton Pajama Set, 4-Piece, Sizes 2T-5T",4,Pajamas,21.99,
"Marvel Spider-Man 6-Inch Figure, Includes Spider Cycle Vehicle",17,Action Figures,37.9,"Overpriced, but what do you expect?"
"Rubie's Spider Man Deluxe Jumpsuit Boy's Halloween Fancy-Dress Costume for Child, M",5,Fancy-Dress Costumes,25.33,
"Spider Man Boy's Halloween Fancy-Dress Costume for Child, S (4-6)",1,Fancy-Dress Costumes,23.55,
"Ultrasonic Pest Repeller, 6 Pack Upgraded Electronic Pest Repellent Plug- in for Mosquitoes Roaches Flea Spiders Ants Mice",203,Insect & Pest Repellent,20.99,Works ONLY against mice!!!
Mite Massacre 8 oz. Spider Mite Killer and Powdery Mildew Fighter - Makes 8 GALLONS of Spray,0,"Pest Bait, Traps & Killers",24.97,
"Bengal Roach Spray, 16 Ounce",21,"Pest Bait, Traps & Killers",26.94,Love it. Trust It.
Marvel Playskool Heroes Super Hero Adventures Spider-Man Swingin' Speeder Set,20,Action Figure Sets,23.48,Great toy
Hasbro Marvel Legends Series Spider-Man: Into the Spider-Verse Peter B. Parker,9,Action Figures,32,Pretty swell
"New Wet & Forget 803064 Spider Control, Liquid, Spray Application, 64 Ounce,Each",0,"Pest Bait, Traps & Killers",35.92,
Marvel Legends Series Spider-Man Symbiote Spider-Man Action Figure,0,Action Figures,37.97,
"Marvel Spider-Man Super Web Slinger, for Kids Ages 5 and Up",3,Action Figure Accessories,39.99,you'll shoot your eye out.
PlayStation Spider-man: Miles Morales for PlayStation 4,582,Video Games,40.49,I've been waiting an entire YEAR for this!
Spidey and His Amazing Friends: Ghost Spider Toddler Deluxe Costume,0,Fancy-Dress Costumes,54.89,
Hasbro Marvel Legends Into the Spider-Verse Gwen Stacy and Spider-Ham Action Figures,6,Action Figures,54.99,
LEGO Marvel Spider-Man Far From Home: Molten Man Battle 76128 Superhero Building Toy for Kids (294 pieces),29,Interlocking Block Building Sets,63.99,
Disneyland Marvel Avengers Campus Interactive Remote Spider-Bot,0,Action Figures,134.99,
LEGO Super Heroes Marvel Spider Mech Vs. Venom 76115 Building Kit,42,Interlocking Block Building Sets,189.95,The best LEGO Venom yet!!!
"Marvel Spider-Man Maximum Venom, Spider-Man Venom Gear, 12-Inch Figure",62,Action Figures,29.84,Spider-Man character
Marvel Spidey and His Amazing Friends Webs Up Mini Action Figure,7,Action Figures,6.99,Cute little toy
"Way to Celebrate Fashion Halloween Female Adult Spider Web Lace Tights, Black One Size",2,Costume Accessories,5.98,
"Carlendan Large Black Spider, Big Plush Spider Halloween Party Prop Decor Haunted House Decoration",0,Decoration,6.3,
"VICOODA 29.5"" Black Large Spider Plush Toy Realistic Hairy Spider Halloween Party Scary Decoration Haunted House Prop Indoor Outdoor Yard Decor",3,Decoration,6.51,scary
Ultimate Sticker Book: Ultimate Sticker Book: Marvel Spider-Man: Into the Spider-Verse (Paperback),2,Books,12.02,
US Toy Company 1192 Mini Spiders - Pack of 12,0,Novelty & Gag Toys,7.81,
Never Touch a Spider! (Board book),0,Books,12.13,
"Hot Shot No-Pest Strip2, Kills Flying & Crawling Insects, 1 Count",54,"Pest Bait, Traps & Killers",10.1,Great product effective
"Green Stretch Spider Web Halloween Decoration by Fun World, 200 sq ft",1,Decoration,9.99,
Marvel Spider-Man: Never a Dull Day Sound Book (Board book),1,Books,15.89,
Marvel Spider-Man Titan Hero Series Black and Gold Suit Spider-Man Action Figure,0,Action Figures,21.98,
Spider-Man Titan Hero Series Web Warriors Ghost-Spider,9,Action Figures,14.94,
BRISON Ultrasonic Pest Repellent Plug In – Mice Rat Spider Repeller - 2pack,23,Insect & Pest Repellent,14.97,
Marvel Spiderman Classic 14 Inch Stuffed Plush Toy,7,Stuffed Animals & Plush Toys,14.99,
"Marvel Spider-Man Web Fluid Refill (Blue), for Ages 5 and Up",9,Action Figures,15,We love spiderman
"Marvel Bend and Flex, Flex Rider Spider-Man Action Figure and 2-In-1 Motorcycle",12,Action Figures,15.09,Transforming Spiderman and bike
Marvel Spidey and His Amazing Friends Spidey Web Slinger Roleplay Toy,2,Action Figures,16.99,
LEGO Super Heroes Spider-Man Bridge Battle 30443,0,Interlocking Block Building Sets,15.9,
"[Spiderman Costume ] Nature Star Spider man costume for kids, Children far-from-Home Cosplay children, Lycra Spandex Zentai suit 3D Style Red Kids",1,Fancy-Dress Costumes,17.25,
"Ortho 0196410 Home Defense MAX Insect Killer Spray for Indoor and Home Perimeter, 24-Ounce (Ant, Roach, Spider, Stinkbug & Centipede Killer)",0,"Pest Bait, Traps & Killers",18.28,
Marvel Licensed Heroes of Goo Jit Zu Hero Pack – 1-Pack Hulk,55,Action Figures,25,
"Marvel Legends Series Spider-Man Spider-Armor Mk I Action Figure, Includes 4 Accessories",0,Action Figures,29.95,
"Stay Away Spiders, Fast Acting, Plant Based, Spider Repellent 4 Pack",1462,Insect & Pest Repellent,24.9,This product works wonderful at repelling spiders!
"Heroes Of Goo Jit Zu Marvel Versus Pack - 2 Exclusive Marvel Heroes 4.5"" Tall Action Figures, Ultimate Spider-Man Versus Doctor Octopus, Boys, Ages 4+",19,Action Figures,24.97,Kids loved this
"Marvel Spider-Man Thwip Blast Integration Suit, 13-inch-Scale Action Figure",9,Action Figure Sets,25.86,Awesome toy!
"Spider-Man Boys Exclusive Christmas Pajama Set, 2-Piece, Sizes 4-12",2,Pajamas,31.99,
"Marvel Licensed Heroes of Goo Jit Zu Supagoo Hero Pack, 1-Pack of 8"" Tall Spider-Man",15,Action Figures,35.76,Wow ! Love!
"All-Natural Bug, Insect & Pest Killer & Control Including Fleas, Ticks, Ants, Spiders, Bed Bugs, Dust Mites, Roaches and More, Safe for Pets and Kids, for Indoor and Outdoor Use, 128 Oz Gallon",1,"Pest Bait, Traps & Killers",29.95,
"Marvel Spiderman Boy's Halloween Fancy-Dress Costume with Hood, Toddler 2T",3,Fancy-Dress Costumes,30.99,
The Amazing Spider-Man / The Amazing Spider-Man 2 (4K Ultra HD + Digital Copy),0,Movies,31.06,
17 Inch Jumbo Tarantula Spider; Lifelike Rubber Arachnid Replica by MameJo,0,Novelty & Gag Toys,32.99,
Spiderman Rumbler Avenger,0,Action Figures,39.99,
Spider-Man Maximum Venom Titan Hero Venom Action Figure Toy,68,Action Figures,33.98,Awesome Action Figure!
Rubies Child Spiderman Homecoming Muscle Chest Costume,3,Fancy-Dress Costumes,34.63,
Tempo Ultra SC 240 ML (812 oz) Multi Use Pest Control Insecticide Spiders Bedbugs Roaches Silverfish etc,4,"Pest Bait, Traps & Killers",43.44,
Squishmallows Official Kellytoy Plush 16 inch Spider - Ultrasoft Stuffed Animal Plush Toy,10,Stuffed Animals & Plush Toys,53,fantastic
"Way to Celebrate Skeleton Spider, Giant 40 Inch Posable Halloween Decoration",4,Decoration,54,"Good product, be careful when extending the legs"
LEGO Marvel Spider-Man Far From Home: Stark Jet and the Drone Attack Superhero Set 76130,15,Interlocking Block Building Sets,115.99,Awesome pack.
Marvel Legends Series Spider-Man Iron Spider Electronic Helmet with Glowing Eyes,0,Action Figures,121.99,
Way To Celebrate Halloween Spider Gnome Figurine 17-inches Multi-color Indoor Decor,1,Figurines & Knick-Knacks,7.24,
World of Reading: This Is Spider-Man Level 1 Reader (Paperback),16,Books,7.92,This is spiderman
Way To Celebrate Halloween 28 Inch Hairy Fabric Spider - Pink,0,Decoration,4.98,
The Amazing Spider-Man (Blu-ray + Blu-ray + DVD),9,Movies,8.99,ANOTHER Spiderman movie?
The Amazing Spider-Man (DVD),29,Movies,9.02,great movie !! :)
"Unique Industries Spider-Man Red Birthday Party Favors, 8 Count",12,Party Favors,1.69,Spider-Man Masks
"Aerb Ultrasonic Pest Repeller, Electronic Insect Repellent Plug-in, 2 Packs Indoor Pest Repellent, for Mosquitoes, Spiders, Bed Bug, Roach, Mice, Fleas, Ants, Flies",2,Insect & Pest Repellent,11.66,
ZOO Superman Soft Bomb Launcher Children's Bracelet Hero Launcher Wrist Toy Superman Role-playing Game Children's Gifts Spider-man Design,3,Action Figures,11.79,
Way To Celebrate Spider Cocoon Halloween Decoration,4,Decoration,12.97,
"Spider-Man Boys Long Sleeve Long Leg Pajama Set, 2-Piece, Sizes 4-10",5,Pajamas,12.98,
"BONIDE PRODUCTS Ready-to-Use Captain Jack Insect Spray, 1 Quart",9,"Pest Bait, Traps & Killers",17.78,
