name,rating,type_of,price,comments
Spider-Man Short Sleeve Crew Neck Solid Printed Pajamas (Toddler) 4 Piece Set,1,Pajamas,15.76,
"Spiderman Toddler Boy Cotton Sleepwear, 2-Piece, Sizes 2T-5T",1,Pajamas,21.99,
Marvel Spider-Man Bend and Flex Black Suit Spider-Man Vs. Doc Ock Action Figures,2,Action Figures,18.79,
"Spider-Man Boys Classic Sleep Tops, Shorts and Pants, 4-Piece Cotton Pajama Set, Sizes 4-10",1,Pajamas,19.98,
"Marvel Legends Series Spider-Man Marvel’s Shocker Action Figure, Includes 4 Accessories",0,Action Figures,20.99,
Marvel’s Spider-Man Youth Size Small Halloween Costume Ages 8+,0,Fancy-Dress Costumes,22.99,
"Ultrasonic Pest Repeller, 6 Pack Upgraded Electronic Pest Repellent Plug- in for Mosquitoes Roaches Flea Spiders Ants Mice",209,Insect & Pest Repellent,23.99,best product for insect phobia
"Spider-Man Boys Pajama Union Suit, Sizes 4-12",7,Pajamas,24.99,
Marvel Spider-Man Daily Bugle Nano Scene & 10 Die-Cast Collectible Figures,19,Action Figures,25,Nice scene with great detail
Hasbro Marvel Legends Series 3.75-inch Retro 375 Collection Spider-Man,0,Action Figures,25.99,
Spidey and His Amazing Friends Change 'N Go Techno-Racer And Miles Morales: Spider-Man Action Figure,30,Action Figure Sets,27.98,
"Rubie's Deluxe Spider-Man Boy's Halloween Fancy-Dress Costume for Child, M",6,Fancy-Dress Costumes,29.99,
"Spidey His Amazing Friends 9” Ghost Spider, Spiderman, Miles Morales Plush Stuffed Toy Set of 3",0,Stuffed Animals & Plush Toys,29.95,
ENFORCER PRODUCTS EBM128 128 oz. Aerosol Spray Icrawling Insect Killer,5,"Pest Bait, Traps & Killers",31.22,
"Marvel's Spider-Man, Sony, PlayStation 4",122,Video Games,31.9,
Marvel Spider-Man Bend and Flex Venom Vs. Carnage Action Figure Toys,4,Action Figures,18.68,
The Amazing Spiderman Super Hero Adventures Deluxe Toddler Costume,0,Fancy-Dress Costumes,39.97,
"Marvel Spider-Man Spider Escape Jet Set, Includes 3 Figures and Vehicle",0,Action Figures,40.02,
Roach Killer & Ant Killer - 12 Pack - Contact And Residual Kill Fleas Spiders Spray Can 3 Oz,0,"Pest Bait, Traps & Killers",41,
"Raid Ant & Roach Killer - Fragrance-Free - Spray - Kills Ants, Cockroaches, Waterbug, Palmetto Bug, Silverfish, Carpet Beetle, Earwig, Spider, Lady Be | Bundle of 2 Packs",0,"Pest Bait, Traps & Killers",41.92,
"Disney AVENGERS CAMPUS Spider-Man MINI SPIDER-BOT 4""x3.5""",0,Stuffed Animals & Plush Toys,46.97,
"Control Solutions Taurus SC Insecticide Termiticide, 20 Ounce Bottle",8,"Pest Bait, Traps & Killers",57.95,
Marvel Legends Series Gamerverse Miles Morales Collectible Action Figure,4,Action Figures,59.88,
LEGO DUPLO Marvel Spider-Man & Friends: Funfair Adventure Toy Set Set 10963 (41 Pieces),6,Interlocking Block Building Sets,59.99,
"Mammoth CANNCONTROL Concentrated Insecticide Spray for Plants, Organic Pesticides for Vegetable and Spider Mites Spray for Indoor Outdoor Plants (1 Liter)",0,"Pest Bait, Traps & Killers",61.51,
LEGO 4+ Spider-Man vs. Scorpion Street Showdown 10754,7,Interlocking Block Building Sets,69.99,
Playskool Heroes Marvel Super Hero Adventures Spider-Man Web-Quarters,14,Action Figure Sets,74.98,
"Spectracide Terminate Termite Detection and Killing Stakes 2 HG-96115, 15 Count",0,"Pest Bait, Traps & Killers",76.69,
"Way to Celebrate Halloween Skeleton Unicorn Reflective Trick or Treat Bag, 14”",0,Party Bags,1.74,
"Way To Celebrate Halloween Garage Door Clings, Spiders",0,Decoration,3.98,
Super Stretch Spider Web,1,Decoration,8.46,
Spider-Man 2 (Blu-ray),1,Movies,8.51,
Spider-Man (DVD),12,Movies,8.98,
Spider-Man 3 (DVD),53,Movies,7.98,
"Marvel Spider-Man 6-inch Mystery Web Gear Marvel's Mysterio Action Figure, 2 Accessories",0,Action Figures,9.64,
Marvel Spider-Man Mystery Web Gear Black and Gold Suit Spider-Man Action Figure,0,Action Figures,9.45,
"2.5FT Halloween Outdoor Decorations Hairy Plush Large Spider,Scary Giant Spider Fake Large Spider Hairy Spider Props for Halloween Yard Decorations Party Decor, Black",1,Decoration,6.99,
Spider-Man 3 (Blu-ray),2,Movies,9.14,
SPIDER WEB STRETCH 4.2OZ (Pack of 1),10,Decoration,9.95,
The Very Hungry Caterpillar Board Book and Plush,230,Books,14.77,
"Halloween Giant Spider Decorations, Large Fake Spider with Straps Hairy Backpack Spider Realistic Scary Prank Props for Indoor Outdoor Yard Party Halloween Decor,29.5""",0,Outdoor Decor,10.94,
Marvel Spider-Man Mystery Web Gear Iron Spider Integrated Suit,1,Action Figures,12.39,
"The Spiderman Stamp Set has drawing pad, sticker roll, stampers and ink pad",0,Party Favors,14.44,
Way To Celebrate Halloween Hairy 72 inch Posable Spider,0,Decoration,13.88,
Amdro Kills Ants and Spiders Home Perimeter Insect Killer; 3 lb. Shaker Bag,9,"Pest Bait, Traps & Killers",13.77,
Marvel Spider-Man: Into the Spider-Verse Titan Series Gwen Figure,13,Action Figures,13.99,
Superhero Spiderman Halloween Costume Clothes Child Fancy Dress Up Kids Boys Juniors Cosplay Outfits Red Blue 3-4 Years (S Size),1,Fancy-Dress Costumes,14.99,
The Amazing Spider-Man 2 (4K Ultra HD + Blu-ray),2,Movies,15.5,
"PESKY® Indoor / Outdoor Bug Stay Away Spray - helps to keep everything from spiders, mosquitos, no see ums, ants, snakes and more away from an area",0,"Pest Bait, Traps & Killers",15.99,
"Marvel Spider-Man Bend and Flex Venom, 6-Inch Action Figure, Web Accessory",14,Action Figures,18.96,
Spiderman Halloween Costume Compatible Superhero Fancy Dress for Child Boys Cosplay Outfits 3D Style 110Size,0,Fancy-Dress Costumes,19.99,
Roach Killer & Ant Killer - 2 Pack - Contact And Residual Kill Fleas Spiders Spray Can 3 Oz,0,"Pest Bait, Traps & Killers",20,
"Ultrasonic Pest Repeller 6 Pack, Insect Control, Spider Repellent, Plug in Indoor Mouse Deterrent, Anti Moths, Ants, Bed Bugs, Fleas, Cockroaches, Flies, Spider, Wasp",3,Insect & Pest Repellent,20.28,
Marvel Spider-Man Titan Hero Series New Black And Red Suit Spider-Man Action Figure,1,Action Figures,21,
"BLCPRO Ultrasonic Pest Repeller 2 Pack, 4 Modes Electronic Insect Repeller & Indoor Pest Repeller for Insect, Rats, Mice, Cockroaches, Spider, Mite, Bug, Ants - Baby and Pet Safe [2021 Latest]",47,Insect & Pest Repellent,21.99,
Marvel Spidey and His Amazing Friends Ghost-Spider Action Figure And Vehicle,28,Action Figures,26.88,
Spider-Man Into the Spider-Verse 6-inch SP//dr Figure,2,Action Figures,22.99,
Ultrasonic Pest Repeller Pest Repellent Ultrasonic Plug in Electronic Pest Repeller Pest Reject for Insect Roach Mice Spider Ant Bug Mosquito Repellent for House Garage Warehouse Office (6 Pack),1,Insect & Pest Repellent,24.95,
Hasbro Marvel Legends Venom Series Ghost-Spider 6-inch Action Figure,6,Action Figures,27.95,
Harris Spider Killer 128oz Ready to Use Trigger Spray,0,"Pest Bait, Traps & Killers",29.87,
Rubies Spiderman Youth 3T/4T Costume w/ Boot tops Mask Gloves,22,Fancy-Dress Costumes,29.99,
"Marvel Spidey and His Amazing Friends Change 'N Go Ghost-Copter, Ghost-Spider Action Figure",19,Action Figures,35.99,
"eKids Spidey and His Amazing Friends Book, Toddler Toys with Built-in Preschool Learning Games, Educational Toys for Fans of Spiderman Toys and Gifts",0,Action Figures,34.99,
Marvel Spider-Man Web Shots Spiderbolt NERF Blaster,21,Blasters & Foam Play,38.99,
"Spider-Man 8 Movie Collection DVD, US Seller Brand New Best Collection",0,Movies,24.97,
"Rubie's Marvel Spider Man Boy's Halloween Fancy-Dress Costume for Toddler, XS",0,Fancy-Dress Costumes,46.98,
The Amazing Spider-Man Omnibus Vol. 1 (Hardcover),0,Books,91.98,
LEGO Super Heroes Spider-Man's Spider Crawler 76114,25,Interlocking Block Building Sets,94.99,
"Way To Celebrate Halloween Outdoor Decoration Hanging Spiders, Black Color, 3 Piece",1,Outdoor Decor,0.98,
"Way To Celebrate Halloween Spider Paper Cutouts, 5 x 5in, 4.5 x 4.5in and 4 x 4in, each size have 3 pieces",0,Decoration,1.94,
Way to Celebrate Halloween Costumes Women's Female Adult Spider Web Arm Warmers,0,Costume Accessories,3.98,
"Ochine Halloween Giant Spider Decorations, Scary Giant Fake Spider Hairy Spider Realistic Scary Prank Props for Indoor Outdoor Yard Party Halloween Decor",11,Decoration,5.77,
Little Golden Book: Miles Morales (Marvel Spider-Man) (Hardcover),1,Books,5.99,
Halloween Decoration Spider Web with 4 Spider White Stretchable Cobwebs,1,Decoration,6.34,
Marvel Spider-Man Bend and Flex Marvel’s Scarlet Spider 6-inch Action Figure,2,Action Figures,14.2,
World of Eric Carle: Happy Halloween from the Very Busy Spider : A Lift-The-Flap Book (Board book),2,Books,8.36,
Marvel Basic Iron Man Action Figure,0,Action Figures,8.88,
nomeni 100 PC Halloween Plastic Spider Joking Toys Decoration Realistic,0,Novelty & Gag Toys,9.44,
"Marvel Spider-Man Stretch Shot Blaster Role Play Toy, Includes 3 Stretchy Web Projectiles",0,Action Figures,7.85,
Spider-Man (Blu-ray),2,Movies,10.99,
"Demon WP 4 pack Insecticide Water Soluble Packets For Cockroaches, Palmetto Bugs, Water Bugs, Spiders, Ants, Scorpions, Earwigs, Silverfish, Boxelder Bugs, Jadera Bugs and more",1,"Pest Bait, Traps & Killers",12.25,
Spiderman Miles Morales Costume Kids Halloween Role Play Wearing Stage Performance One-Piece Cosplay Jumpsuits Set New,0,Fancy-Dress Costumes,15.5,
JOYIN 23X18 ft Triangular Mega White Spider Web with Cobweb and 24 Spiders for Outdoor Halloween Decoration Yard,0,Decoration,21.99,
"Marvel Spiderman 34.5"" Bop Bag Kids Inflatable Punching Bop Bag Exercise",1,Novelty & Gag Toys,17.59,
Spider-Man: No Way Home (Walmart Exclusive)(DVD) Exclusive Slip Cover Art,0,Movies,17.96,
"5 Pack Halloween Spider Decorations Sets,Halloween Table Runner,Cobweb Fireplace Mantel Scarf,Round Lace Spider Table Topper and Lampshade,36pcs 3D Bats for Halloween Table Decors Party Supplies",0,Decoration,18.99,
Spidey And His Amazing Friends Birthday Party Supplies Tableware Set Spider Hero Amazing Friends Children’s Party Favors Plates Napkins Tablecover for Spider Hero Birthday Baby Shower Decor,0,Party Supply Sets,18.95,
Marvel Avengers Iron Spider 6-Inch-Scale Action Figure Toy,3,Action Figures,19.25,
"Marvel Spider-Man Bend and Flex 6-Inch Ghost-Spider Figure, with Web Accessory",12,Action Figures,18.99,
"Marvel Spider-Man Bend and Flex Miles Morales Action Figure, Web Accessory",5,Action Figures,20.87,
"Marvel Spider-Man Bend and Flex Green Goblin Action Figure, 4 Accessories",10,Action Figures,20.89,
Spiderman Birthday Party Tableware and Banner Kit for 16 Guests,0,Party Supply Sets,21.6,
Figure Spider-man Action figure Movable Toy,3,Action Figures,22.65,
"Marvel Spider-Man Bend and Flex Spider-Man Action Figure, Web Accessory",13,Action Figures,23.87,
Spiderman Costume Boys kids light up Spider Size T FREE MASK T (2-3),3,Fancy-Dress Costumes,23.99,
Marvel Legends Series Doctor Strange Collectible Action Figure,6,Action Figures,25.88,
Spider-Man Titan Hero Series Web Warriors: Miles Morales,11,Action Figures,25.29,
Spiderman Mega Mix Favor Pack (for 8 Guests),0,Party Favors,16,
"Spiderman Party Supplies | Spiderman Birthday Party Supplies | Spiderman Plates, Birthday Napkins, Paper Cups, Spiderman Tablecloth, Spiderman Birthday Banner | Marvel Superhero Birthday Party Supplie",0,Party Favors,26.9,
Carnage Venom Titan Hero Miles Morales Spider-Man Figure Toy Gift 8in,0,Action Figures,27.81,
Hasbro Marvel Legends Series Spider-Man: Into Spider-Verse Marvel’s Prowler,39,Action Figure Sets,31.99,
"Outdoor Halloween Decorations - Scary Spider Decorations Set with 50"" Giant Realistic Spider, 200"" Triangle Web & 5 Mini Spiders Hairy Spiders Props for Indoor Outdoor Garden Creepy Halloween Decor",0,Decoration,35.97,
TureClos Skull Spider Toy Cool Infrared Spider Skull Toy Sturdy Remote Control Spider Toy Non-toxic Wireless Skeleton Spider Toy Anti-fall for Home Children,0,Novelty & Gag Toys,36.75,
"Team Spidey & Friends Ghost-Spider, Spidey, Miles Morales, Ms. Marvel, Black Panther, Hulk & Trace-E Action Figure 7-Pack",12,Action Figures,49.4,
"Rubie's SpiderMan Second Skin Halloween Fancy-Dress Costume for Adult, Men M",6,Fancy-Dress Costumes,76.98,
Amazing Spider-Man by J. Michael Straczynski Omnibus Vol. 1 Hc (Hardcover),0,Books,74.72,
"Way To Celebrate Halloween Spider Top Hat Headband, Red",3,Costume Accessories,4.23,
"Unique Industries Spider-Man Assorted Colors Birthday Party Favors, 48 Count",1,Party Favors,5.73,
"Black Flag Spider & Scorpion Killer2, Aerosol, 16 oz",30,"Pest Bait, Traps & Killers",9.56,
Spider-Man 2 (Special Edition) (DVD),3,Movies,7.14,
"Hirt's Ocean Spider Plant - Easy to Grow - Cleans the Air - NEW - 3.5"" Pot",44,Live Plants,5.99,
Baby Toys Anti-Stress Trick Toy Simulation Spider for Kids Party Birthday Gift Popular Toys for Boys 5-7 Sponge,0,Novelty & Gag Toys,6.29,
7 Sizes Halloween Giant Spider Hanging Decoration House Haunted Outdoor Yard Halloween Spider Props Decor,0,Decoration,6.59,
"Halloween Giant Spider Decorations, Large Fake Spider with Straps Hairy Backpack Spider Realistic Scary Prank Props for Indoor Outdoor Yard Party Halloween Decor",7,Decoration,6.38,
"Marvel Spider-Man Plastic Party Tablecloth, 84in x 54in, 2ct",1,Tablecloths,6.88,
"Marvel Spiderman Birthday Plastic Party Tablecloths, 84in x 54in, 2ct",1,Tablecloths,6.88,
Spider-Man 'Webbed Wonder' Hanging Swirl Decorations (12pc),0,Decoration,10.6,
Miles Morales: Shock Waves (Original Spider-Man Graphic Novel) (Paperback),0,Books,11.84,
"Marvel Spidey and His Amazing Friends Ghost-Spider Hero Action Figure, 1 Accessory",0,Action Figures,9.49,
Alex Cross Novels: Along Came a Spider (Series #1) (Paperback),21,Books,9.69,
The Spider Who Saved Christmas (Hardcover),8,Books,10.62,
TY Beanie Boo Marvel Spider-Man Plush (Reg Size - 6 inches),3,Stuffed Animals & Plush Toys,11.72,
Marvel Ultimate Spider-Man Titan Hero Series Iron Spider Figure - 12 Inch,2,Action Figures,12.67,
Under the Northern Sky: The Spider (Series #2) (Paperback),0,Books,12.25,
Rubie's Spider-Man Gloves Halloween Costume Accessory,9,Costume Accessories,12.99,
Spectrum HG-64490 Hot Shot 11 Ounce Spider Killer,0,"Pest Bait, Traps & Killers",15.28,
Marvel Spider-Man 6-inch Deluxe Web Spin Spider-Man Movie-Inspired Action Figure,0,Action Figures,16.99,
"Ultrasonic Pest Repeller 6 Pack Pest Repellent, Pest Control Plug in Indoor Pests for Mosquito, Insects,Cockroaches, Rats, Bug, Spider, Ant, Rodent",21,Insect & Pest Repellent,17.98,
"Coolmade 276"" Halloween Spider Web 59"" Halloween Spider Decorations Stretch Cobweb Fake Spider Giant Spider Web for Indoor Outdoor Halloween Decorations",0,Outdoor Decor,17.99,
"Spider-Man Maximum Venom Titan Hero Ghost-Spider Action Figure, Ages 4 and up",17,Action Figures,19.98,
"Marvel Spider-Man Bend and Flex Iron Spider Action Figure, 2 Accessories",13,Action Figures,24.95,
Spider-Man Hasbro Marvel Legends Series Amazing Spider-Man Cloak Build-A-Figure SP//dr Action Figure Novelty Character Collectibles,1,Action Figures,24.64,
Penguin Classics Marvel Collection: The Amazing Spider-Man (Hardcover),0,Books,28.49,
Marvel Avengers Spider-Man Little Girls Tulle Cosplay Costume Dress Leggings and Headband 3 Piece Set Spiderman 7-8,0,Fancy-Dress Costumes,27.99,
"Heroes Of Goo Jit Zu Marvel Supagoo Hero Pack 8"" Tall Super Stretchy Spider-Man Miles Morales Action Figure, Boys, Ages 4+",21,Action Figures,28.49,
Marvel Legends Series Iron Spider Action Figure,0,Action Figures,29.99,
"3 Spider Plants, Naturally Air Purifying House Plant in 4"" Pots, Easy Care, Live Indoor House Plant",12,Live Plants,34.95,
1PK Wet and Forget Miss Muffet's Revenge Liquid Spider Killer 64 oz.,0,"Pest Bait, Traps & Killers",36,
"Fun World Sparkling Spider Girl's Halloween Fancy-Dress Costume for Child, S",3,Fancy-Dress Costumes,46.5,
"Rubie's 2 in 1 Reversible SpiderMan Halloween Fancy-Dress Costume for Child, Big Boys M",8,Fancy-Dress Costumes,45.84,
FANCY Skull Spider Toy Cool Infrared Spider Skull Toy Sturdy Remote Control Spider Toy Non-toxic Wireless Skeleton Spider Toy Anti-fall for Home Children,0,Novelty & Gag Toys,56.34,
Spider-man: Far From Home (4K + 3D + Blu-ray),0,Movies,59.99,
Talstar P Insecticide 3/4 Gal Roaches Fleas Spiders Ants Stink Bug -not For Ny Ct,0,"Pest Bait, Traps & Killers",61.99,
LEGO Super Heroes Spider Man Bike Rescue 76113,35,Interlocking Block Building Sets,98.04,
"Sony Playstation 5 Disc Version (Sony PS5 Disc) with White Extra Controller, Media Remote, Spider-Man: Miles Morales Ultimate Launch Edition, Accessory Starter Kit and Microfiber Cleaning Cloth Bundle",0,Video Games,899,
Way To Celebrate Glittr Cling Spider.,0,Decoration,1.74,
"Way to Celebrate Fashion Halloween Female Adult Spider Web Net Tights, Black, One Size",1,Costume Accessories,5.68,
The Girl in the Spider's Web: A New Dragon Tattoo Story (DVD + ),7,Movies,5.98,
"Black Large Spider Plush Toy Realistic Hairy Spider Halloween Party Scary Decoration Haunted House Prop Indoor Outdoor Yard Decor,19.7""",0,Decoration,5.89,
Along Came a Spider (DVD),2,Movies,7.34,
Spider-Man Titan Hero Series Web Warriors: Spider-Girl,4,Action Figures,9.19,
Marvel Spider-Man Mystery Web Gear Upgraded Black and Red Suit Spider-Man Action Figure,0,Action Figure Sets,12.39,
Marvel Spider-Man Titan Hero Series Spider-Man Figure,9,Action Figures,11.75,
The Girl in the Spider's Web / The Girl With the Dragon Tattoo (Blu-ray + Digital Copy),2,Movies,12.13,
"3PCS Halloween Lighted Spider Egg Sacks, Hanging Spider Egg Sacs with Spider Web, 60 Spiders, DIY Halloween Decorations Outdoor and Indoor Yard Tree Hanging Props Ornaments",13,Decoration,13.19,
Jada 33075 1941 Ford Pickup Truck Candy Red & Blue Proto-Suit Spider-Man Diecast Figurine Marvel Series Hollywood Rides Series 1-32 Scale Diecast Model Car,0,Figurines & Knick-Knacks,12.89,
Ultrasonic Pest Repeller - Mosquito Repeller - Upgrade 2019 Insect Bug Repellent Indoor - Electromagnetic Plug in Pest Control - Electronic Repel Mice Rat - Reject Flea Spider -6PACK,7,Insect & Pest Repellent,14.98,
"Fun Little Toys Spider Webs Halloween Decorations, Outdoor Halloween Decorations, Giant Spider With Spider Web, Halloween Home Decor, Halloween Spider, Scary Halloween Decorations",0,Party Favors,14.99,
Marvel Avengers Infinity War Spider-Man 8 Inch Phunny Plush,5,Stuffed Animals & Plush Toys,17.79,
Spiderman Miles Morales Costume Kids Halloween Role Play Wearing Stage Performance One-Piece Cosplay Jumpsuits Set New,1,Fancy-Dress Costumes,17.99,
"Husfou Halloween Decorations Spider Web, 16x16ft Giant Triangular Spider Web, 120 Small Fake Spiders, 40g Stretch Cobwebs Spider Webs Costumes Halloween Decorations for Outside Yard Garden Lawn Party",1,Outdoor Decor,19.99,
"Bengal Ant & Spider Killer, 17 oz",2,"Pest Bait, Traps & Killers",22.1,
"New Bonide 363 B70 Spider and Ground Bee Killer, Solid, Indoor, Outdoor, 10 Ounce Container,Each",0,"Pest Bait, Traps & Killers",22.84,
"Nature Star Spiderman Costume For Adult, Superhero Spider Suit Far-From-Home Cosplay For Adult Men 150Cm To 190Cm (3D Style Lycra Spandex) Red",0,Fancy-Dress Costumes,22.91,
Marvel Spider-Man Mystery Web Gear Doctor Strange Action Figure,0,Action Figures,23.95,
Hasbro Marvel Legends Series Spider-Man Marvel’s Frog-Man 6-inch Action Figure,7,Action Figures,19.99,
Way to Celebrate Girls Child Halloween Gothic Spider Fantasy Costumes,6,Fancy-Dress Costumes,24.97,
Spider-Man Titan Hero Series Web Warriors: Black Suit Spider-Man Action Figure,10,Action Figures,24.99,
Carnage Venom Titan Hero Miles Morales Spider-Man Figure Toy Gift 8in,0,Action Figures,27.79,
Hasbro Marvel Legends Series 6-inch Figure Velocity Suit Spider-Man,8,Action Figures,42.99,
Hasbro Marvel Legends Series 6-inch Action Figure Spider-Armor MK III,5,Action Figures,39.89,
Spider-Man: Far From Home Concept Series Glider Gear Spider-Man 6-Inch Action Figure,4,Action Figures,39.97,
"Heroes of Goo Jit Zu Water Blast, 1-Pack Action Figure, Redback the Spider",70,Action Figures,39.99,
LEGO Marvel Spider-Man Vulture's Trucker Robbery 76147 Building Toy for Superhero Fans Ages 4 and up (93 Pieces),12,Interlocking Block Building Sets,39.99,
Cosplay Life Spider-Man Far From Home Cosplay Costume | Lycra Fabric Bodysuit Superhero Halloween Zentai Suit (XS),3,Fancy-Dress Costumes,45.99,
Leg Avenue Plus Size Womens Halloween Spider Costume T Shirt Dress,3,Fancy-Dress Costumes,38.99,
LEGO Super Heroes Spider-Man Car Chase 76133,23,Interlocking Block Building Sets,49.99,
LEGO Marvel Spider-Man The Menace of Mysterio 76149 Superhero Building Toy Preschool Action Figure (163 Pieces),11,Interlocking Block Building Sets,53,
Spider-Man: Into the Spider-Verse Titan Hero Series Miles Morales with Titan Hero Power FX Port,9,Action Figures,54.99,
LEGO Super Heroes Spider-Man: Doc Ock Diamond Heist 76134,9,Interlocking Block Building Sets,61.99,
Marvel Legends Series Spider-Man: Far from Home 6-In Spider-Man,15,Action Figures,68.99,
Marvel Spider-Man Multi Movie Collection Pack,12,Action Figures,89.99,
LEGO DUPLO Super Heroes Spider-Man & Hulk Adventures?10876,21,Interlocking Block Building Sets,91.99,
"Child Spiderman Halloween Gloves Accessory, Red and Black",0,Costume Accessories,2.97,
TERRO Spider & Insect Trap - 4 Traps,6,"Pest Bait, Traps & Killers",7.54,
"Marvel Spidey and His Amazing Friends Hero Figures Assortment, Styles May Vary with Purchase or Pick Up Today",0,Action Figures,5.88,
YEGBONG 50ml Kills Ants Roaches Spiders Insecticide Spray Plants Extracts Fresh Smell  for Children Pets,0,"Pest Bait, Traps & Killers",5.99,
MarinaVida Spider Halloween Decoration Haunted House Prop Indoor Outdoor Black-Giant,7,Decoration,6.28,
"Marvel Spider-Man Bend and Flex Mysterio, 6 inch Action Figure, Ages 4 and Up",0,Action Figures,7.98,
nomeni 20 PC Halloween Plastic Spider Joking Toys Decoration Realistic,0,Novelty & Gag Toys,7.98,
"Halloween Holiday Collection Decorative Throw Pillow Cover, 18"" x 18"", Crow and Spider, 1 Pack",16,Decorative Pillow Covers,8.9,
Spider-Man: The Venom Saga (DVD),2,Movies,11.89,
"HOOJO 1000 Sqft Spider Webs Halloween Decorations with 60 Fake Spiders, Cobwebs Halloween Decorations Indoor and Outdoor Party Supplies",0,Decoration,12.99,
Marvel Super Hero Adventures Playskool Spider-Man Action Figure Set,1,Action Figures,12.97,
2pcs Boy Kids Long Sleeve Spiderman T-shirt+Pants Outfits Pajama Set Sleepwear,4,Pajamas,12.98,
"Aerb Ultrasonic Pest Repeller, 10W Powerful Plug-in Insect Repellent, Electronic Pet Safe Pest Repellent, Indoor Pest Defender for Mosquitoes, Spiders, Bed Bug, Roach, Mice, Fleas, Ants, Flies(4 Pack)",1,Insect & Pest Repellent,14.98,
Marvel Spiderman Swing iPad Tablet Pillow - Soft Holder Rest Support Pillow,1,Travel Pillows,14.99,
"Spider-Man Boys Hooded Pajamas Set, Sizes 4-12",0,Pajamas,15.98,
Marvel Spidey and His Amazing Friends Change 'N Go Web-Crawler And Spidey Action Figure,30,Action Figure Sets,15.99,
"Terro 3200 Spider Traps 4 in a package, (Pack of 4, 16 Traps Total)",5,"Pest Bait, Traps & Killers",17.99,
Spider-Man Titan Hero Series Web Warriors Ghost-Spider,1,Action Figures,19,
Spider-Man: Far From Home / Spider-Man: Homecoming (DVD),0,Movies,31.33,
Marvel Comics Spiderman Embroidered Classic Character Costume Snapback Hat,2,Fancy-Dress Costumes,20.95,
"Jada Toys Marvel Nano METALFIGS 20-Pack Wave 2 Die-Cast, 1.65"", Collectible Figurines, 100%",32,Action Figures,20.99,
Spider-Man: Into the Spider-Verse 6-inch Marvel's Scorpion Figure,3,Action Figures,21.99,
Marvel Spider-Man Mystery Web Gear Doctor Strange Action Figure,0,Action Figures,23.95,
Marvel Spidey & His Amazing Friends Miles Morales Super Soft Kids Pillow Buddy,0,Stuffed Animals & Plush Toys,24.61,
Hasbro Marvel Legends Series Retro 375 Collection Symbiote Spider-Man Action Figure,0,Action Figures,15.28,
Hasbro Marvel Legends Series Spider-Man The Hand Ninja 6-Inch Action Figure,5,Action Figures,24.95,
"Spider-Man and Friends Toddler Boys Fleece Pajama Set, 2-Piece, Sizes 2T-4T",2,Pajamas,24.95,
"Spider-Man Figure with Power FX Cycle Plays Sounds and Phrases, Ages 4 and Up",14,Action Figures,34.99,
Marvel Gamerverse Spider-Man Spider-Man vs. Mister Negative 2-pack,8,Action Figures,40.12,
Childrens Eensy Weensy Spider Costume,0,Fancy-Dress Costumes,67.25,
Marvel Avengers Ultimate Protectors Action Figures 8 Pack,0,Action Figures,46.95,
"Halloween Spider Decorations, 6 Pcs Realistic Hairy Spiders for Indoor and Outdoor Spooky(50"", 35"", 30"", 20"", 12"", 12"")",2,Decoration,50.99,
"Spider-Man (""The Amazing Spider-Man"") Deluxe Adult Halloween Costume",10,Fancy-Dress Costumes,54.83,
"Eco Defense Pest Control Pouches - All Natural - Repels Rodents, Spiders, Roaches, Ants, Moths & Other Pests - 12 Pack - Best Mouse Trap Alternative",26,"Pest Bait, Traps & Killers",59.66,
Marvel Spider-Man Multi Movie Collection Pack,12,Action Figures,89.99,
Marvel Legends Series Spider-Man: Far from Home 6-In Mysterio Figure,2,Action Figures,89.99,
"LEGO Marvel Spider-Man Attack on The Spider Lair 76175 Cool Building Toy, Featuring The Spider-Man Headquarters; Includes Spider-Man, Green Goblin and Venom Minifigures, New 2021 (466 Pieces)",0,Interlocking Block Building Sets,108.99,
Spider-Man Nerf Power Moves Marvel Spider-Man Web Blast Web Shooter Roleplay Toy,15,Blasters & Foam Play,55.17,
"Marvel’s Spider-Man Maximum Venom Mask, Adjustable Strap, Ages 5 and Up",7,Action Figure Sets,23.8,
"Vendor Labelling Halloween Glow Party Favors, Green Plastic Glow Spider., 1 Count, Unisex",3,Party Favors,0.98,
Halloween Essentials Novelty False Nail Set - Pink Spiders & Bats 24-Piece Press-On Nail Collection,0,Costume Accessories,3.24,
"Marvel Spidey and His Amazing Friends 48 Page Coloring Book With 4 Crayons, Paperback",0,Books,3.97,
Fridja Educational Solar Powered Spider Robot Toy Solar Powered Toy Gadget Gift,0,Electronic Pets,5.17,
"Yesbay 30Pcs/Set Plastic Realistic Mini Spider Toy Halloween Party Prop Decoration,Green 2.2 x 1.5CM",0,Party Favors,5.69,
"Marvel Spider-Man Thwip Shot Blaster Role Play Toy, Includes 3 Stretchy Web Projectiles",0,Action Figures,7.99,
Topumt Spider Halloween Decoration Haunted House Prop Indoor Outdoor Black-Giant,2,Outdoor Decor,8.2,
