name,rating,type_of,price,comments
"Eliminator Ant, Roach & Spider Killer4, 20 oz, Kills Insects & Spiders",4.084,"Pest Bait, Traps & Killers",3.48,"Covered one up in phone. The roach crawled out of the foam and kept going.  Its wings were slightly ruffled.  Curious, I placed it in a jar.  24 hours later it is going strong with pep in its step.  I could wait for it to die of old age but instead placed it outside.  What a lucky roach that I did not have Raid!"
"Spiderman Party Blowers, 8ct",,Novelty & Gag Toys,3.74,
"TERRO Spider and Ant Killer Aerosol Spray, 16 Ounce",4.5333,"Pest Bait, Traps & Killers",4.97,EXTREMELY disappointed. Raid worked way faster. This stuff is expensive. Will Not be buying again. Got plenty left anyway.
"Hot Shot Fresh Floral Scent Ant, Roach & Spider Killer Spray, 21.87 Oz",4.1032,"Pest Bait, Traps & Killers",6.36,Sprayed them directly 10 times. did nothing!
"Eliminator Ant, Roach & Spider Killer4, Aerosol Spray, 2/20-Ounce",4.3548,"Pest Bait, Traps & Killers",5.98,It does somewhat kill on contact but it's really not that great of a spray.
"Zevo Ant, Roach and Spider Crawling Insect Spray, 10 oz",4.0253,Insect & Pest Repellent,6.97,"It says “spray insects” which indicates it's not for pest control but to kill the bugs you currently see.  This product is not spray and it dries.  Nope, it is for spray, wait for the bugs to die and then dry the area with paper towels.  This product leaves a extremely oily residue that does not dry and is NOT easy to clean up.  I will include a pictures of what a “quick spray” of this product left behind when I used it around my kitchen trash can.  It took 15 paper towels and then I had to use a spray bottle of vinegar and water to mop the rest up.  The odor of this product IS NOT for those who have a sensitive nose.  It is so overpowering and I cannot and will not use it again.  With the oily residue, I was sure glad the ants were on my tile and not running along a baseboard in a carpeted room or along one of my rugs.  I took the pictures an hour after I sprayed this product…it was not dry.  I just cannot handle the residue or the odor.  I will be looking for another pet and people safe product to use."
"Raid Essentials Ant, Spider & Roach Killer 27, 10 oz Aerosol",4.257,"Pest Bait, Traps & Killers",6.98,Man!!! I've done bought three cans of this for all the roaches  living  in my sleep spot.  I spray them roaches all night and they be coming back.  Found it even work better smashing them roaches with my hands then this spray.  Don't even think about getting this stuff in your eyes be burning for days.  Not so safe after y'all saying natural.    Stick to the professional bug killas my complex paid for once I was complaining.  No more roaches after they spray.  They did come back three times but now I don't see nothing and my family live in peace.
"STEM Kills Ants, Roaches and Spiders: plant-based active ingredient bug spray, botanical insecticide for indoor and outdoor use; 10 oz. 1 pc",4.5837,"Pest Bait, Traps & Killers",16.19,I received product reimbursement in exchange for my honest review. I used this product on ants and was not impressed. I had to spray the ants 2 times and wait a couple of more seconds before I saw them dying. The smell of this product is also very strong and not my favorite. I will be sticking to my normal brand.
Ortho Home Defense Insect Killer for Indoor & Perimeter 2 Ready-To-Use 24oz,3.6717,"Pest Bait, Traps & Killers",8.9,I have used this product for years with a false sense of security. Today I found a Brown Recluse (Violin on its back) in the house and caught it live in a mason jar. I sprayed THREE PUMPS of Ortho Home Defense MAX Insect Killer For Indoor & Perimeter on a piece of cardboard and dropped it in the mason jar with the spider. Three hours later the spider is still very much alive. This product is a waste of money.
ZURU Robo Alive Battery Powered Crawling Spider Robotic Toy - Electronic Pet,4,Electronic Pets,7.97,"I was thinking the for it's price, it should have came with a remote, needless to say it didn't, was way smaller than I would have thought, and get this , the battery that vibrates the thing only lasts 30 or so minutes, just a stiff little plastic spider that vibrates, if I were to need another cool spider it won't be this one, I'll get one with a remote , which btw, happens to be around 5 or so dollars cheaper and looks more real, sorry guys but I'd say leave this one alone"
2.7OZ ROACH&FLEA FOGGER,3.7683,"Pest Bait, Traps & Killers",9.26,Bought two boxes which is a total of 6 cans and only 3 of them worked. I hope the company does something for me.
Spider-Man: Homecoming (Blu-ray + DVD),4.7308,Movies,9.95,The digital code included expired two years ago.
The Amazing Spider-Man / The Amazing Spider-Man 2 (DVD),3.5385,Movies,9.96,"When I purchased this collection, I thought I would be getting the digital copy for both movies. I only received the digital copy for amazing Spiderman 1 and not amazing Spiderman 2."
Spider-Man: Homecoming (DVD),4.5714,Movies,11.94,I love the movie. But I am far from pleased with the site to store process. I will never use that method ever again.
14 oz. Kitchen Bug Killer Spray Killing Ants Flies Roaches Spiders HOT SHOT,5,"Pest Bait, Traps & Killers",11.98,
"Ortho Home Defense Insect Killer for Indoor & Perimeter Refill 2, 1.33 gal.",4.4056,"Pest Bait, Traps & Killers",12.8,"I've been using this product for years keeping the ants out of my house. It used to be hard to apply as it had a pump spray and it used to have the work max on the bottle. Bought a bottle this years and the ants were killed... For a day. Used the entire gallon just on the back of my house over the course of a week. The ants were back the very next day every time. I went to my basement and found what was left of last years bottle(i used it last year inside and out in my house and had left over),  and since i didn't have much left I sprayed just the problem areas. (The back of my house where i wasted an entire gallon of this years product.)  The ants are gone. Its been 4 days and they haven't come back. So as my titla says it used to be great but apparently they decided to upgrade to a wand so that its easier to apply, but changed to an inferior product that no longer works. I would much rather pumo spray a product that is effective than wand a prduct that might as well be water."
Spider-Man: Into the Spider-Verse (Blu-Ray DVD + ),4.625,Movies,11.89,I have bought movies and when j bought it it downloaded to vudu.   But NOT this one!  I can not access the digital copy until i have the disc in hand!  Sucks!
"Toddler Officially Licensed Boys Marvel Spiderman Toddler Halloween Costume, 2T, Red and Blue",4.4706,Fancy-Dress Costumes,15,My kid wanted it before 29th Oct for school event. He got very upset.  If he don't get it before 9.30 am tomorrow he will not go to school.
"Ortho Home Defense Insect Killer for Indoor, Perimeter2, 1.33 Gal.",3.8471,"Pest Bait, Traps & Killers",16.44,I love the spray. Its Walmart lacking in sending the spray wand that it comes with. Lucky I had an empty spray bottle that I hardly wasted any in dumping the huge bottle into the tiny whole. Duh.
Terro 16 oz. Spider Killer Aerosol Spray - 2 Spray Bottles T2302-2,4,"Pest Bait, Traps & Killers",15.55,
"Ortho Home Defense Insect Killer for Indoor & Perimeter2 Ready-To-Use - With Trigger Sprayer, Long-Lasting Control, Kills Ants, Cockroaches, Spiders, Fleas & Ticks, Non-Staining, Odor Free, 1 gal.",,"Pest Bait, Traps & Killers",16.77,
Spider-Man Five-Movie Collection (DVD),4.1667,Movies,17.11,"This is a new product.  However, the disks were scratched and has fingerprints all over it when I initially opened it.  Could not fully watch The Amazing Spider-Man 2, due to disk issues."
TERRO T2302 Spider Killer Aerosol Spray,,"Pest Bait, Traps & Killers",15,
"Raid MAX Perimeter Protection, 1 Gallon",4.5067,"Pest Bait, Traps & Killers",17.58,I have used this product for 2 weeks spraying every other day and it doesn't kill the sugar ants. Actually It doesn't Phase them at all. It's like water. No smell at all. The spray can Raid ant & Roach kills on contact. It just doesn't last long.
Spider-Man: No Way Home (DVD),3.8333,Movies,17.96,It doesn't play on my new dvd player
Spider-Man: Far From Home / Spider-Man: Homecoming (Blu-Ray),4.8,Movies,18.98,
"Nature-Cide All Purpose Insect Repellent. All Natural Roach Killer, Spider, Cockroach, Mosquito and Ant Spray to Keep Your Home Safe. Kills on Contact. No Strong Odor. 32 oz",3,"Pest Bait, Traps & Killers",19.95,
"Tomcat Household Pest Glue Boards, for Roaches, Insects, Scorpions, and Spiders 3 Pack",4.9333,"Pest Bait, Traps & Killers",20.65,
Spider-Man: No Way Home (Blu-Ray + DVD),4.6207,Movies,22.96,I've seen the movie in the theater when it first came out. I needed it for my collection. If it wasn't for the fact that walmart.com charged my card twice I would order from here again
"Marvel Spider-Man Super Web Slinger Role-Play, With Web Fluid, Shoots Webs or Water",3.1429,Action Figures,16.21,"DO NOT BUY! This is the worst present possible. Sprayed on my celing.... and it STAINS! Daughter got it dor Christmas, does not spray in a string, it comes out in a blob that goes everywhere. STAINS ceiling and walls. DO NOT PURCHASE!"
"EcoLogic Home Insect Control 64 Ounces, Ready-To-Use Spray, Kills Ants, Cockroaches And Spiders",4.6304,"Pest Bait, Traps & Killers",24.99,"[This review was collected as part of a promotion.] I was so excited to get this product, since we live in the middle of a National Forrest and have sooo many bugs in the Spring/summer months. So far we have not noticed any difference in the amount of unwanted flying and crawling critters. It may not be best suited for areas where there are an over abundance, bit may do well in a suburban/city area."
Spider-Man: No Way Home (4K Ultra HD + Blu-ray),5,Movies,25.49,
Spider-Man: 6-Film Collection (DVD),4.625,Movies,26.99,
"BugMD Termination Station Trap - Combination of Light, Heat and Glue - Pests, Bugs, Ticks, Spiders, Moths, Flea Killer - Bed Bug Traps for Inside Your Home with Refills - Flea Bombs Fogger for Home",1.5,"Pest Bait, Traps & Killers",29.97,
Spider-Man: Far From Home / Spider-Man: Homecoming / Spider-Man: No Way Home (Blu-ray),4.8333,Movies,28.97,
"Eco Defense USDA Biobased Pest Control Spray - Ant, Roach, Spider, Bug Killer and Repellent - Natural Indoor & Outdoor Repellent Spray - Child & Pet Friendly",4.0714,"Pest Bait, Traps & Killers",35,This product worked good at killing pests and was helpful for getting rid of them while I'm living in the house.  I didn't have to worry about any chemicals.  PROBLEM - BOTTLE WAS NOT FULL AND I USED IT UP IN DAYS...TOO SMALL FOR CONTROLLING PESTS SO HIGHLY DISAPPOINTED!!!
"Spider-Man Titan Hero Figure 6-Pack, Available Only At Walmart",4.9512,Action Figure Sets,49.99,
Onslaught FastCap Spider and Scorpion Insecticide MGK Insecticide Concentrates,3,"Pest Bait, Traps & Killers",68.95,
"Marvel Spiderman Slap Bracelet Party Favors, 4 Count",4.5833,Party Favors,1.48,
"Spiderman Birthday Plastic Party Tablecloth, 84 x 54in",4.75,Tablecloths,2.97,
Itsy Bitsy Spider (Board Book),4.375,Books,6.37,
LEGO Marvel Spidey And His Amazing Friends Miles Morales: Spider-Man’s Techno Trike 10781 Building Kit; Miles Morales Set Makes a Fun Gift Idea for Kids Aged 4+ Who Love Super-Hero Play (59 Pieces),4.8333,Interlocking Block Building Sets,7.99,
"Spiderman Birthday Party Favors for 8 Guests, 48pcs",4.0625,Party Favors,8.97,"For someone who was trying to do a small celebration on a budget, I wish I hadn't wasted money on this. The glasses didn't fit or stay on my children. We don't do tattoos and the only thing that we liked is the stickers."
"Raid Max Spider & Scorpion Killer, 12 oz",4.494,"Pest Bait, Traps & Killers",9.34,"Unused product. I bought the wrong brand to take care of the spiders that will hatch out this spring in Minnesota. Will be returning Raid Spider Killer to local store customers service. I am 88 yrs old, asthmatic,"
Marvel Spider-Man Titan Hero Series Spider-Man 12-inch-Scale Super Hero Action Figure,4.413,Action Figures,8.44,My box was torn upon arrival I was highly disappointed due to this being one of my son Christmas gifts I will never order from here again!!! I did a video and sent it to my mom but it won't allow me to upload the video here !!
Spider-Man: Into the Spider-Verse (DVD),4.7297,Movies,9.9,My dvd did not arrive with a slip cover like it was shown in the picture on the website.
Spider-Man Triple Feature (DVD),4.8621,Movies,9.96,Doesnt come with digital copies of all 3 movies. I will be returning these once I get them. Be clear on your advertising.  this made me so mad.
Spider-Man: Far From Home (DVD),4.7179,Movies,12.96,bad movie toooooo long.  disappointing
"Spider-Man Men's Miles Morales Sleep Pants, Size S-2XL",5,Pajamas,14.48,
Spider-Man: Far From Home (Blu-Ray + DVD),4.8254,Movies,14.96,
"Spider-Man Kids Bedding Plush Cuddle and Decorative Pillow Buddy, 100% Polyester, Red, Marvel",4.7478,Decorative Pillows,14.98,"This was a Christmas present for my 5 y.o. because he had been asking for it. When I purchased it felt very sturdy. Now, less than 3 months later, after not much roughplay (he mostly sleeps with it and sometimes plays with it) the seams have come undone exposing stuffing. We've had plenty of stuff animals that have had more roughplay with for years that have not come apart at the seams. I expected this to last longer, but my son does still sleep with it."
"Child Officially Licensed Boys Marvel Classic Spiderman Halloween Costume Medium, Red and Blue",2.7273,Fancy-Dress Costumes,15,Would give zero stars if I could!! Should have believed the reviews - the 5 star reviews MUST be fake!! The costume received is NOTHING like the picture. Very thin material. Separate pants and top. See through. Mask is too small. No muscles. VERY DISAPPOINTED!
"Marvel Spider-Man Spiderbolt Armor Gear Set, Spiderbolt NERF Blaster, Role Play Mask",4.375,Blasters & Foam Play,19.99,"item damaged
darts have broken tipped"
"Spiderman Boys Short Sleeve Shirt and Shorts, 2-Piece Pajama Set, Sizes 4-12",4.4286,Pajamas,28.96,
LEGO Marvel Spidey And His Amazing Friends Hulk vs. Rhino Truck Showdown 10782 Building Kit; Playset Comes with 2 LEGO Spider-Man Vehicles; Birthday Gift for Kids Aged 4+ (110 Pieces),5,Interlocking Block Building Sets,17.81,
LEGO Super Heroes Spider-Man’s Drone Duel 76195 Building Kit (198 Pieces),4.5862,Interlocking Block Building Sets,17.99,A Lego spider man drone is a poor substitute for a Marvel advent calendar. That's like ordering white socks and you replace it for white shoes. The only comparison is they go on your feet. The same thing goes for my order. My daughter is now very disappointed for not having an advent calendar tomorrow.
LEGO Marvel Spider-Man & Green Goblin Mech Battle 76219 Building Kit (296 Pieces),4.6957,Interlocking Block Building Sets,19.99,
"Spiderman Pinata, Pull String, 18 x 15in",3.7234,Pinatas,19.99,"The piñata was completely busted, and it is cheaply made! I'm so mad because I bought this for my son's 4th birthday party and now I have to figure something out last minute. Even if it did not come in busted, I still feel like it is not worth the money I spent on it. Don't waste your coins!"
"Spiderman Boys Short Sleeve Top and Pants, 2-Piece Pajama Set, Sizes 4-10",5,Pajamas,19.99,
LEGO Marvel Spider-Man: Spider-Man & Doctor Octopus Mech Battle 76198 Building Toy (305 Pieces),4.6538,Interlocking Block Building Sets,20,
Heroes of Goo Jit Zu Marvel Spider-Man vs Venom Action Figure,3.2273,Action Figures,22.5,After 1 full day the paint is peeling off the toy and looks worn. My child is not rough on toys at all. We are very disappointed.
Marvel Legends Series Upgraded Suit Spider-Man Scale Action Figure,4.4425,Action Figures,34,neck joint broke off after 2 head swaps. worst marvel legend made. my son has a ton of marvel legends and swaps parts off since they come w extra parts. waiting on their customer service to get back to me with what i can do since it was a christmas gift and we threw out the original box.
"Hasbro Marvel Spider-Man Action Armor Set Role Play Toy, Mask, 2 Gauntlets, 6 Web Blasts",4.1765,Action Figures,20.48,"DO NOT BUY-DOES NOT WORK- The helmet is the only thing that is ok. Other than that, it does not work. The web shooters do not shoot properly. We bought it thinking maybe it wld work bc the silly putty web shooter doesnt work. But nope. The same. Just made cheaply w cheap parts. So we sent them back. So now u know. Dont buy it or yll be sending it back. Ok love u guys."
LEGO Marvel Spider-Man Figure 76226 Building Kit,4.8889,Interlocking Block Building Sets,24.97,
"Marvel Spidey and His Amazing Friends Web Squad Figure Collection, 5 Action Figures",4.619,Action Figures,24.97,Drove 45 minutes to find out that this item was not on the shelf even though the store showed 4 available. I had two store employees search for it and they couldn't find it.
Spider-Man: No Way Home (4K Ultra HD + Blu-ray),5,Movies,25.49,
"Spider-Man Classic Exclusive Boys Hooded Union Suit Pajama, Sizes 4-12",4.3333,Pajamas,34,
"Marvel Spider-Man Web Gear Spider-Man Action Figure, Spider Legs, Web Blasters, and More",4.8333,Action Figures,29.84,
LEGO Spider-Man at Doc Ocks Lab 10783 Building Set (131 Pieces),5,Interlocking Block Building Sets,24.99,
LEGO Spider-Man Headquarters 10940 Building Set (36 Pieces),4.8889,Interlocking Block Building Sets,23.99,
Spider-Man: No Way Home (4K Ultra HD + Blu-ray + Digital Copy) (Steelbook),,Movies,34.23,
Marvel's Spider-Man: Game of the Year Edition - PlayStation 4,4.578,Video Games,28.99,"The order was shipped and delivered within a day HOWEVER the package was delivered wrapped in a Walmart plastic bag with sticker! This is absolutely unacceptable. This was a gift and wasn't properly packaged, someone could've easily identify the gift and taken it! Also the picture that was emailed to me was NOT visible."
LEGO Spider-Man at the Sanctum Workshop 76185 Building Set (355 Pieces),4.5926,Interlocking Block Building Sets,39.97,"While I appreciate the details of the workshop, this build is incredibly flimsy both in the process of building as well as the final build. My son stopped early on from frustration with the angled pieces (he's built plenty of advanced & expert sets) and this build for me was almost as frustrating as the Domo. There needs to be more foundation and reinforcement in the angled parts. It certainly was not worth the money. And yes, I checked all parts to makes sure they are fully attached. It's just a poor design. Love the details which salvaged a star."
LEGO Marvel Spidey And His Amazing Friends Spider-Man Webquarters Hangout 10784 Building Kit for Ages 4+ (155 Pieces),4.2,Interlocking Block Building Sets,40.99,
"Marvel Spider-Man Web Chompin' Spider-Rex Action Figure, Sounds and Dino Blast Action",4.3571,Action Figures,46.97,"[This review was collected as part of a promotion.] My kids love dinosaurs and a spiderman dinosaur was even better. They loved it. Unfortunately, the button to shoot the pieces out is next to impossible to push as a small child, my wife and I even had a hard time pushing it down so the kids were pretty disappointed they couldnt get it."
"Spider-Man Titan Hero Figure 6-Pack, Available Only At Walmart",4.9512,Action Figure Sets,49.99,
LEGO Marvel Spider-Man Attack on the Spider Lair 76175 Collectible Building Toy (466 Pieces),4.4545,Interlocking Block Building Sets,79.97,The packaging was beaten up and the bag was tapped to the box. This is a gift and it looks like it went through a washer. Can't give this to anyone. How do I get a refund??
"LEGO Marvel Spider-Man Daily Bugle 76178 Building Kit; Collectible Playset Designed with Adult Marvel Fans in Mind (3,772 Pieces)",4.5625,Interlocking Block Building Sets,349.95,"Waiting to receive item, and completely disappointed for how much money I spent  only top receive an item missing pieces and some of our stickers were damaged."
"Tomcat Glue Boards with Enhanced Stickiness, 4 Glue Boards",4.1514,"Pest Bait, Traps & Killers",2.93,"I purchased 6 packets of these ""enhanced sticky"" traps and laid them around my garage.  For further enticement, I put a small tub of peanut butter on it.  Please see the picture of what I found in the morning.  The peanut butter tub was almost empty and there was a lot of poop all over the trap.  What a waste of money!  And yes, I did take off the plastic covering to expose what was suppose to be sticky.  What a waste of money."
"Spiderman Paper Party Masks, 8ct",5,Party Favors,3.27,
"Catchmaster Heavy Duty Baited Rat Glue Traps, 2 Count",4.2069,"Pest Bait, Traps & Killers",3.43,Glue on this trap is not as strong as other brands.  Disappointed.  Using it outside .
"Spiderman Hanging Decorations, 12ct",3,Decoration,4.26,
"Eliminator Ant, Flea & Tick Killer Plus Granules, 10lb",4.0804,"Pest Bait, Traps & Killers",6.48,"I bought it because I was expecting it to kill fleas. I bought it online so I couldn't fully read the back. When I got ut and was trying to figure out how to use it for fleas, there were no directions for how to use it for fleas. Actually fleas weren't even in the list of bugs it kills!"
"Spidey and Friends Toddler Boy Pajama Set, 2-Piece, Sizes 2T-5T",5,Pajamas,8,
"Spiderman Boys Long Sleeve Top and Pants, 2-Piece Pajama Set, Sizes 4-12",1,Pajamas,10.98,
"Glow in the Dark Stretch Spider Web Halloween Decoration by Fun World, 165 sq ft",3,Decoration,3.88,
"Spiderman Boys Long Sleeve Pajama Set, 2-Piece, Sizes 4-12",4.1333,Pajamas,24.25,it  was the wrong size  i ordered a size 8 not 4-5
Spider-Man: Homecoming (4K Ultra HD + Blu-ray),4.4545,Movies,14.99,
"Spiderman and His Amazing Friends Boys Tops and Pants, 4-Piece Cotton Pajama Set, Sizes 12M-5T",1,Pajamas,15.76,
"Spiderman Baby and Toddler Boy Pajamas, 4-Piece, Sizes 12M-5T",4,Pajamas,15.98,I ordered a 5t and it fits more of a 2t. Definitely size up 2 sizes.
"Spider-Man Boys Character Union Suit, Sizes 4-16",3,Fancy-Dress Costumes,15.98,
"Spiderman Baby and Toddler Boy Pajamas, 4-Piece, Sizes 12M-5T",4,Pajamas,15.98,
LEGO Super Heroes Spider-Man vs. Mysterio’s Drone Attack 76184 Building Set (73 Pieces),4.3704,Interlocking Block Building Sets,16.99,Mysterio Wasn't in no way home he was in far from home
Spider-Man: No Way Home (Walmart Exclusive)(Blu-Ray + DVD) Exclusive Slip Cover Art,,Movies,18.59,
The Amazing Spider-Man: 2-Movie Collection (Limited Edition Collection) (Blu-ray),3.75,Movies,18.99,
Spider-Man: Into the Spider-Verse (4K Ultra HD + Blu-Ray + ),4.4667,Movies,18.59,Did not come with digital copy. Returning
"Spiderman Toddler Boys Long Sleeve Top and Pants, 2-Piece Pajama Set, Sizes 2T-5T",,Pajamas,8.98,
Spider-Man Trilogy (Blu-Ray + Digital Copy),5,Movies,20.99,
Spider-Man: Far From Home (4K Ultra HD + Blu-ray),4.4167,Movies,16.99,
Marvel Spider-Man - Me Reader Electronic Reader with 8 Book Library - Pi Kids,4.3889,Books,18.89,
Spider-man: Far From Home (Walmart Exclusive) (Blu-ray DVD + Night Monkey Action Figure),4,Movies,27.96,
Hot Shot 7832991 17.5 oz Ant&#44; Roach & Spider Killer,4.7178,"Pest Bait, Traps & Killers",3.94,"Hot Shot DOES NOT kill roaches.  

I was five inches away from a countertop full of them (yes- disgusting) and was DRENCHING them in this stuff.  Some of them were doing an impressive backstroke in the growing puddle of “Hot Shot,” but they weren't expiring.  

Mind you- all of them were “under water”- completely immersed in the liquid from the can.

Unless there is a delayed reaction where they go home and die in their sleep after they go to sleep it off, all this stuff does is make them flail around.  A couple of them were staggering a little as they went back to their hidey holes after they got out of the pool, but none of them died right in front of me.  Not one.

Maybe it kills little baby ones [edit: no, it doesn't] but the ones in here are about three quarters of an inch long.  They are just your standard roaches- we don't live next door to Three Mile Island or anything.  And while they appeared briefly disoriented after being sprayed, not one of them expired that I could see.

So “Kills On Contact” is not true.  “Fast Knockdown” is not true either, unless this term refers to them falling over before learning the backstroke really fast before scampering off.  This product should be called “Shower Time for Roaches,” not Hot Shot.  It doesn't stink and has a rather pleasant scent, but I didn't buy it because I needed an air freshener.  Maybe the roaches like the smell- I don't know.

I'm stuck with two full cans of this crap with bugs everywhere.  …Well- it is making ME feel funny.  Maybe it makes you so woozy you forget the bugs are there.  Oh- and it will give you a headache. 

Spend the dollar plus whatever more, and get Raid.  That stuff does the job.  This stuff is garbage. 

(I tried an experiment.  I sprayed a baby roach in order to observe the “effects” of this product under more controlled circumstances.  I squirted it.  It ran away from the wetness, then stopped.  Ah, thought I- it's dead.  Nope.  I had just given it a “time out,” and after a few moments of walking a little irregularly, it “stood up straight” and walked away as if nothing had happened to it.  I thought I may have heard a tiny “Thanks for the free bath, lady!” as it vanished.)"
LEGO Spider-Man Mech 76146 Building Set (152 Pieces),4.5735,Interlocking Block Building Sets,33.95,Box smashed badly. Hate to give as gift. Won't know if broken till grandson receives for Valentine's and puts together.
The Amazing Spider-Man / The Amazing Spider-Man 2: Limited Edition Collection (4K Ultra HD + Blu-ray),5,Movies,34.64,
Marvel Spiderman Mech Halloween Costume Size Large. Ages 8+,,Fancy-Dress Costumes,34.97,
