name,rating,type_of,price,comments
"Spidey and his Amazing Friends - Feature 6"" Vehicle 2 in 1 Spidey Stealth Strike",2,Action Figure Sets,24.94,
"Nokiwiqis Push Bubble Toys, Spider/ Spider Web/ Unicorn Shaped Fidget Toys",0,Novelty & Gag Toys,11.07,
Marvel Spider-Man Titan Hero Series Green Goblin 12-Inch Action Figure,0,Action Figures,11.99,
Spider-Man Titan Hero Series Spider-Man Figure,39,Action Figures,13.98,
LUSHVIDA Halloween Tablecloth- Rectangle 60x84 inch Orange Spider Web Pattern Wrinkle Resistant Tablecloths for Halloween Decoration,0,Tablecloths,20.99,
Marvel Spider-Man Bend and Flex Iron Spider,33,Action Figure Sets,14.98,
24Pcs Halloween Pressing Toys Cute Pumpkin Ghost Spider Stress Relief Toys Kids Halloween Party Favors Bag Filler Gifts Decorations,0,Novelty & Gag Toys,14.88,
"Set of 5 Halloween Tinsel Garlands 6.6 feet for Indoor, Outdoor Spooky Party Wall Decorations Supplies, Pumpkin, Bats & Spiders",0,Decoration,12.99,
"Elowel Boys Glow in The Dark ""Spider"" 2 Piece Pajama Set 100% Cotton (Size2Y-10Y)",5,Pajamas,17.99,
Spidey and his Amazing Friends - Light Show Ghost Spider Vehicle,21,Action Figures,17,
"Ultrasonic Pest Repeller Plug in New 2019 Pest Repellent, Power Saving, Home Indoor and Outdoor Use, Pest Reject 6Pack Rat Repellent, Mice Repellent, Mosquitos, Roachs, Spiders, Bed Bugs, Fleas",2,Insect & Pest Repellent,18.93,
"Marvel Titan Hero Series Iron Spider 12-In Action Figure, Power FX Port",6,Action Figures,18.99,
Marvel 12 in x 15 in Blue Spiderman Web Crawler Polyester Decorative Lumbar Pillow,0,Decorative Pillows,19.78,
"Spiderman Toddler Boys' Pajamas, 2-Piece Set",25,Pajamas,19.99,
12 Lot Black Flag Roach Motel Trap Cockroach Bug Killer Bait Glue Traps Spider Motels,1,"Pest Bait, Traps & Killers",21.49,
Marvel Legends Series Spider-Man Marvel’s Hammerhead Action Figure,0,Action Figures,24.95,
Marvel’s Spider-Man Integrated Suit Youth Halloween Costume -Small,0,Fancy-Dress Costumes,22.99,
Tobey Maguire Spider-Man 3-Pack Trilogy [Blu-ray],2,Movies,23.99,
Marvel Spider-Man Legends Series Spider-Woman Collectible Action Figure,3,Action Figures,27.99,
Legends Series Spider-Man: Far from Home 5.9-In Spider-Man,6,Action Figures,30.43,
"Spider-Man Boy's Halloween Fancy-Dress Costume for Adult, L",15,Fancy-Dress Costumes,30.99,
Spider-Man Boys' Symbiote Costume Pajamas Suits (Big Boys),0,Pajamas,26.34,
Amazing Spider-Man Venom PVC Action Figure Toys Gifts for Children,0,Action Figures,32.98,
"Dancing Spider-Man Robot Toys, Spin Robot Interactive Toy Car with Colorful Flashing Lights & Music, Interactive Educational Gift Toys for 3 4 5 6 7 Year Old Boys Girls",1,Novelty & Gag Toys,29.5,
Spider-Man: Into the Spider-Verse Shockstrike Miles Morales Spider-Man,15,Action Figures,32.9,
Avengers Marvel Legends Series 6-inch Spider-Man Action Figure,2,Action Figures,79.99,
"Spider-Man Marvel Legends Series 6-inch Marvel’s Rhino Retro Action Figure Toy, Includes 3 Accessories",1,Action Figures,44.84,
Spider-Man Marvel Legends 6-Inch Spider-Man 2099 Figure,1,Action Figures,50,
Ultimate Spider-Man Omnibus Vol. 1 (Hardcover),0,Books,10,
"Demon WP Insecticide -Kills Cockroaches, Spiders and Other Pests - Case (12 x 4 x 9.5g Packets) by Syngenta",0,"Pest Bait, Traps & Killers",87.99,
Marvel Spider-Man Legends Series 6-In Doppelganger Spider-Man Figure,8,Action Figures,88.99,
Marvel’s Spider-Man Youth Halloween Costume Size Small. Ages 2+,1,Fancy-Dress Costumes,9.98,
Terro T3206 Spider & Insect Trap 4 Count,11,"Pest Bait, Traps & Killers",5.29,
Valatala Flower Plant Insect Spray Potted Plant Insect Spider Spray,0,"Pest Bait, Traps & Killers",6.57,
"Halloween Black Large Spider, Plush Spider for Indoor, Outdoor Halloween Party Prop Decor",0,Decoration,7.9,
Little Golden Book: Marvel Spider-Man Little Golden Book Favorites (Marvel: Spider-Man) (Hardcover),0,Books,8.86,
"Black Flag Spider and Scorpion Killer 16 Ounces, Aerosol Insecticide Spray",12,"Pest Bait, Traps & Killers",7.98,
"The Baby's Handbook : Bilingual (English / Spanish) (Inglés / Español) 21 Black and White Nursery Rhyme Songs, Itsy Bitsy Spider, Old MacDonald, Pat-a-cake, Twinkle Twinkle, Rock-a-by baby, and More: Engage Early Readers: Children's Learning Books (Paperback)",0,Books,9.29,
"Way To Celebrate Halloween Glow In the Dark Spider Web, 16'",2,Decoration,9.23,
Q Version of The Revenge Joint Cake Decoration Animation Hand-Made Toy Model Doll Steel Spider Bat Cake Decoration Q Version of The Superhero 6-Piece Set of Plastic Models,0,Action Figures,10.11,
"Maggie's Farm Simply Effective Ant & Roach Killer Spray, 14 oz",53,"Pest Bait, Traps & Killers",9.73,
7pcs/set Spider-Man Marvel Super Hero Action Figure Collection Kids Toys Gifts,0,Action Figures,9.99,
"Large Plastic Spiderman Goodie Bags, 6ct",0,Party Bags,10.99,
Ultrasonic Plug In - 2020 New - Outdoor/Indoor Electronic - Get Rid of Rat Mouse Squirrel Bug Bee Cockroach Fly Spider Mosquito-Safe for Pet (Black),35,Insect & Pest Repellent,12.99,
"Spider-Man Spidey and his Amazing Friends 9"" Plush Toy with Suction Cup",27,Stuffed Animals & Plush Toys,12.99,
Marvel Spiderman Color Your Own Tote Kit Includes Tote Bag and Markers,0,Party Favors,14.87,
"Ultrasonic Pest Repeller 6 Pack Pest Repellent, Pest Control Plug in Indoor Pests for Mosquito, Insects,Cockroaches, Rats, Bug, Spider, Ant, Rodent",4,Insect & Pest Repellent,17.99,
Marvels Spider-Man Short Sleeve Cotton 4 Piece Pajama Set (8),0,Pajamas,18.98,
Minecraft Cave Spider Papercraft,0,Novelty & Gag Toys,19.94,
"Live Spider Plant - 4"" Hanging Pot - Black",0,Live Plants,21.99,
"playskool heroes marvel super hero adventures mega mighties spider-man collectible 10-inch action figure, toys for kids ages 3 and up",0,Action Figures,24.99,
"Spiderman Boys Pajama Blanket Sleeper, Sizes 4-12",71,Pajamas,33.53,
Spider-Man: Far From Home Under Cover Spider-Man 6-inch Action Figure,2,Action Figures,30.95,
Squishmallows Halloween Squad 8 inch (Bella The Spider),0,Stuffed Animals & Plush Toys,24.99,
"BLCPRO Ultrasonic Pest Repeller, 3 in 1 Electronic Pest Control Plug in Insect Repellent with Frequency Conversion Technology for Mosquito, Rat, Spider, Mouse, Ant, Cockroach, Bedbug",11,"Pest Bait, Traps & Killers",26.99,
Revenge Of The Heroes Returns The Amazing Spider-Man Action Figure Boxed Model Maf047,1,Action Figures,24.76,
Marvel Legends Series 60th Anniversary Amazing Fantasy Spider-Man Action Figure,1,Action Figures,36.95,
Amazing Spider-Man Epic Collection: Great Power (Paperback),0,Books,30.1,
Spider-Man by Todd McFarlane: The Complete Collection (Paperback),1,Books,32.28,
Marvel Spider-Man Legends Series 6-Inch Hydro-Man Collectible Action Figure,4,Action Figures,32.98,
Spider-Man Hulk Hulk Trader Fist Gloves 1 Pair A,0,Action Figures,30.21,
Disney Marvel Spider-Man Talking Action Figure New with Box,0,Action Figures,34.99,
Marvel Legends Spider-Man: Far from Home Spider-Man (Stealth Suit),4,Action Figures,49.99,
"Marvel 6″ Ultimate Protectors Super Hero Avengers Action Figures, (8-Pack)",1,Action Figures,59.88,
"Heroes of Goo Jit Zu Marvel Hero 4-Pack, Spider-Man, Hulk, Iron Man and Captain America",4,Action Figures,72.99,
Marvel Comics Classic Spiderman Costume Pajama Union Suit One-Piece Outfit,0,Pajamas,54.95,
Amazing Spider-Man by Michelinie & McFarlane Omnibus (Hardcover),0,Books,71.97,
Wet & Forget Miss Muffet's Revenge Spider Killer - 4 Pack,0,"Pest Bait, Traps & Killers",86.62,
Marvel Spider-Man 6-inch Legends Series Marvel?s Moon Knight,0,Action Figures,124.99,
Marvel Comics Library. Spider-Man. Vol. 1. 1962-1964 (Hardcover),0,Books,158.7,
World of Reading: Level 2: The Amazing Spider-Man : The Story of Spider-Man (Paperback),2,Books,4.85,
"EFINNY Halloween Scary Spider Decorations, 1 Pcs Realistic Hairy Spiders Set, Scary Spider Props For Indoor, Outdoor And Yard Creepy Decor (7 Different Sizes)",8,Outdoor Decor,6.87,
"Spider Man Hanging Decorations, 26 in, 3ct",1,Decoration,6.89,
Spider-Man 2 (DVD),1,Movies,7.98,
"Realistic Hairy Giant Spider, Real Large Fake Spiders for Halloween Outdoor Decoration House Prank Prop",0,Decoration,9.99,
Allaugh Remote Control Joke Spider Toys Halloween Scare Robot Prank Fake Scare Robot Climbing Car with 8 Legs Realistic,2,Novelty & Gag Toys,13.99,
Marvel Spider-Man: Across the Spider-Verse Spider-Man 6-Inch Action Figure with Accessory,11,Action Figures,11.99,
"Spiderman, Superheroes, Cosplay, Adult, Children, Kids Costume, Halloween",0,Fancy-Dress Costumes,11.99,
"Halloween Spider Webs, Happiwiz 900 sqft Spider Webs Halloween Decorations Bonus with 100 Fake Spiders, Super Stretch Cobwebs for Halloween Indoor and Outdoor Party Supplies Decorations",0,Decoration,11.99,
Marvel Spider-Man: Across the Spider-Verse Miles Morales 6-Inch Action Figure,8,Action Figures,11.99,
"1000 Sqft Halloween Spider Web Decorations,Stretchy Large Fake Spiderwebs with 100 Extra Fake Spiders for Outdoor Cobwebs Halloween Party Decor",0,Decoration,12.29,
"Spider-Man Boys' 2-Piece Pajamas - royal blue, 7 - 8",4,Pajamas,17.99,
Marvel Spidey and His Amazing Friends Hero Reveal 2-Pack Spidey and Trace-E,17,Action Figure Sets,11.99,
"Marvel Asst Super Realz - Hulk, Captain America, Spiderman Figures in Display- 1 PC EACH, TOTAL 3 PCS",0,Action Figures,19.89,
"Hedstrom - 60"" Bop Bag, Marvel Spider-Man",1,Novelty & Gag Toys,11.98,
"Squishmallows 5"" Miles Morales Spider-Man Marvel Plush",0,Stuffed Animals & Plush Toys,20.85,
"Hot Shot Ant, Roach & Spider Killer 2-17.5 oz, Unscented, Twin Pack",157,"Pest Bait, Traps & Killers",21.59,
"BioCare Spider And Silverfish Traps, 6 Count",16,"Pest Bait, Traps & Killers",12.96,
Asdomo Boy Superhero Spider-Man Costumes Gift - For Kids And Adults Party Cosplay Costumes,0,Fancy-Dress Costumes,22.31,
"Spider-Man Boys' Top and Shorts Pajama Set, 2-Piece, Sizes 4-10",10,Pajamas,21.99,
"BASF Freeze II Hornets Spider Yellow Jackets, Wasp Insecticide Aerosol, 17.5 Ounce",0,"Pest Bait, Traps & Killers",22.99,
Spider-Man: Homecoming /Far From Home/No Way Home 3-Movie Set (Blu-ray),0,Movies,17.97,
Jada 31750 2008 Dodge Viper SRT10 Dark Gray with Venom Diecast Figurine Spider-Man Marvel Series 1 by 24 Diecast Model Car,193,Figurines & Knick-Knacks,24.99,
Ultimate Spider-Man Mega Favor Pack - Party Supplies - 48 Pieces,0,Party Favors,25.22,
Figure Spider-man Action figure Movable Toy,0,Action Figures,25.49,
Marvel Spider-Man: Across the Spider-Verse Spider-Man 2099 Action Figure,0,Action Figures,11.99,
CARPANT/TERMITE KLR 1.3G (Pack of 1),31,"Pest Bait, Traps & Killers",28.78,
"Ultrasonic Pest Repeller (6 PACK), Anpro Electric Mice Repellent Plug-in Rodent Repellent Indoor for Insect Roach Mice Spider Ant Bug Mosquito Repellent",2,Insect & Pest Repellent,29.99,
Amazing Spider-Man Epic Collection: Great Power (Paperback),0,Books,30.1,
Spider-Man Toddler Costume,3,Fancy-Dress Costumes,34.99,
Jada Toys Nano Minifigs Marvel Spider-Man Wave 7 Set Of 18 Diecast Mini Figures,1,Action Figures,35.99,
LONGRV Spider-Man Maximum Venom Titan Hero Venom Action Figure Toy,0,Action Figures,35.01,
Marvel Spider-Man: Across the Spider-Verse Miles Morales Web-Shot Slinger Mask and Blaster,5,Action Figures,43.99,
Disney Avengers Campus Spider-Bot Iron Man Tactical Upgrade Marvel Iron Man - NEW,0,Action Figures,44.97,
Cosplay Life Homecoming Spider Superhero Cosplay Costume Lycra Fabric Bodysuit Spandex Zentai Suit With Detached Mask and Lenses For Adult Men,2,Fancy-Dress Costumes,45.99,
Spider-Man 8 Movie Collection DVD,0,Movies,55.99,
Amazing Spiderman (PS3),5,Video Games,68.96,
Artist Edition: Todd McFarlane's Spider-Man Artist's Edition (Hardcover),0,Books,130,
"Way to Celebrate Fashion Female Child Fashion Spider Web Lace Tights Halloween,Medium",0,Costume Accessories,4.96,
Spider-Man Far From Home (Walmart Exclusive),0,Books,4.98,
20 PC Halloween Plastic Black Spider Joking Toys Decoration Realistic,0,Action Figures,5.1,
SPRING PARK Set of 2 Witch Gnomes Plush Halloween Decorations with Spider Bat Ornaments Scandinavian Doll Elf Halloween Gnomes Decorations Indoor Home Party Toys for Kids Adults,0,Decoration,12.85,
Disney Frozen 2 Blue Jumbo  Filler Egg with 40 Tattoos,9,Easter Eggs,7,
Itsy Bitsy Spider (Board book),1,Books,7.75,
Halloween Giant Spider Decoration Large Hairy Spider Realistic Scary Prank Prop for Indoor Outdoor Yard Party Halloween Decor,2,Outdoor Decor,7.99,
Spider-Man - New Anim Series: High Voltage Villain (DVD),0,Movies,7.96,
World of Reading: Spidey Saves the Day : Spidey and His Amazing Friends (Paperback),0,Books,7.99,
Superhero Series Action Figures Spider-Man Venom Assembled Building Blocks Toys Minifigure,2,Interlocking Block Building Sets,8.98,
MAGGIES FARM LTD 7OZ Spider/Insect Dust MSID007,0,"Pest Bait, Traps & Killers",10.87,
Spider-Man Titan Hero Series Web Warriors: Armored Spider-Man,13,Action Figures,11.49,
"TY Beanie Baby - MILES MORALES - Marvel Spider-Man 6"" Plush",3,Stuffed Animals & Plush Toys,11.69,
Marvel Spider-Man: Across the Spider-Verse Spider-Gwen Action Figure with Accessory,0,Action Figures,11.99,
"Tomcat Household Pest Glue Boards, (For Roaches, Insects, Scorpions, and Spiders) (2 Pack)",14,"Pest Bait, Traps & Killers",13.35,
"Halloween Decorations Spider Web Toys, 25 Fake Spiders for Halloween Decor Horror Room Decor Indoor Outdoor Party Favors",147,Decoration,13.99,
"RG Costumes Glitter Spider Witch Girl's Halloween Fancy-Dress Costume for Child, L (12-14)",0,Fancy-Dress Costumes,17.58,
Spider-Web Toy for Kids 5+ Cobweb Launcher Black and Red Gloves Hero Cosplay Prop Wristband,0,Costume Accessories,15.99,
"Spider-Man Boys Two-Piece Pajama Set Male, Red, Size: 8, Marvel",0,Pajamas,16.97,
12pcs Marvel Spiderman Goodie bags Party Favor Goody Bags Spider-Man Gift Bags,0,Party Bags,18.99,
"alextreme Nature Star Spiderman Costume For Adult, Superhero Spider Suit Far-From-Home Cosplay For Adult Men 150Cm To 190Cm (3D Style Lycra Spandex) Red Fashion",0,Fancy-Dress Costumes,19.07,
"Marvel Spider-Man Miles Morales Toy, Spider-Man: Across the Spider-Verse Action Figure",8,Action Figures,25.34,Spiderman Miles Morales
"Marvel Spidey and His Amazing Friends Glow Tech Techno-Racer Toy Car, Miles Morales Action Figure",0,Action Figures,26.44,
Marvel Spider-Man Titan Hero Series Venom Action Figure,0,Action Figures,26.49,
Marvel Comics Men's Spiderman Comic Allover Print Loungewear Pajama Pants,1,Pajamas,26.95,
"Spider-Man Boys Long Sleeve Long Leg Cotton Pajama Set, 4-Piece, Sizes 4-10",0,Pajamas,27.99,
Ready! Set! Race! RC Infrared Spider,0,Novelty & Gag Toys,28.72,
"moobom Spider-Man Toy 6"" Action Figure Movable For Children Fun Gift Durable Peter Parker Legends",0,Action Figures,29.59,
"Marvel Spider-Man Bend and Flex Green Goblin Action Figure, Includes 4 Accessories",33,Action Figures,29.99,Great action figure!
"Spider-Man Party Supplies Pack 8 Guests: Plates, Cups Napkins, Table Cover",2,Party Supply Sets,29.99,
"Rubie's Spider-Man Muscle Boy's Halloween Fancy-Dress Costume for Child, S",7,Fancy-Dress Costumes,29.01,
"Marvel Avengers: Infinity War Nerf Iron Spider Assembler Gear, Includes 3 Darts",6,Blasters & Foam Play,34.1,Grandson VERY HAPPY
Spider-Man by Roger Stern Omnibus (Hardcover),0,Books,82.99,
"Hirt's House Plant Collection - Parlor Palm, Spider Plant, Snake Plant",19,Live Plants,37.38,Great plants
"My Friend Spidey 16"" Feature Plush with Sounds",28,Stuffed Animals & Plush Toys,38.48,Spidey To The Rescue
Squishmallows Official Kellytoys Plush 7 inch Ghost Spidey Spider Man,0,Stuffed Animals & Plush Toys,39.99,
Marvel Spider-Man Legends Series Marvels Scorpion Collectible Figure,0,Action Figures,74.99,
Spider-Gwen Omnibus (Hardcover),0,Books,80.79,
World of Reading: This Is Spider-Man (Paperback),0,Books,4.99,
Little Golden Book: Trapped by the Green Goblin! (Marvel: Spider-Man) (Hardcover),0,Books,4.99,
"Ultrasonic Pest Repeller Plug in New 2019 Pest Repellent, Power Saving, Home Indoor and Outdoor Use, Pest Reject 6Pack Rat Repellent, Mice Repellent, Mosquitos, Roachs, Spiders, Bed Bugs, Fleas",6,"Pest Bait, Traps & Killers",25.98,Good Bye
Pete the Cat: Pete the Cat and the Itsy Bitsy Spider (Hardcover),1,Books,6.92,
Catlerio Halloween Giant Spider Hanging Decoration House Haunted Outdoor Yard Halloween Spider Props Decor,0,Decoration,8.1,
HOMEMAXS 6pcs Halloween Spider Trick Toy Realistic Spider Small Insect Animal Trick Toy Color Random,0,Novelty & Gag Toys,7.99,
PatPat 1-pack/3-pack Halloween Cobweb Decorations Spider Web Fireplace Mantel Scarf & Round Table Cover & Tablecloth for Halloween Party Decor,0,Decoration,11.99,
"Ultrasonic Plug In, Outdoor/Indoor Electronic - Get Rid of Rat Mouse Squirrel Bug Bee Cockroach Fly Spider Mosquito-Safe for Pet (Black)",8,"Pest Bait, Traps & Killers",9.99,This really works!!!
Yellies! Webington; Voice-Activated Spider Pet; Ages 5 and up,5,Electronic Pets,9.99,So fun!!
Cyber Monday 2021! VOBERRY Educational Solar Powered Spider Robot Toy Solar Powered Toy Gadget Gift Gifts for Kids,0,Novelty & Gag Toys,10.81,
"New Ty Spiderman Plush, Red/blue, Regular Plush Stuffed Animal Plush Toy",2,Stuffed Animals & Plush Toys,11.69,
"Ultrasonic Pest Repeller - Pest Repellent Electronic Pest Control (Spiders, Mosquitoes, Bed bugs, Fruit flies, Ants and etc.),Eco-Friendly, Human & Pets Safe - Ultrasonic Pest Repeller - 4 Packs",3,Insect & Pest Repellent,11.95,
"Toikido YuMe Brand Frank Plush Spider - Back to the Outback, 8inch Soft Collectible Cuddle Toy",2,Stuffed Animals & Plush Toys,11.97,
Marvel Spider-Man Bend and Flex Missions Venom Space Mission Action Figure,7,Action Figures,17.99,Perfect toy!
Spider Large Horror Large Polyester Spider Toy Simulation Spider Toy,0,Action Figures,11.99,
Spider-Man Graphic Novels (Marvel Paperback): Spider-Man : Kraven's Last Hunt (Paperback),6,Books,12.71,
Spider-Man (Full Screen Special Edition),7,Movies,13.96,
Disney Junior Marvel Spidey and His Amazing Friends: Spidey to the Rescue Sound Book (Board book),0,Books,13.91,
"Marvel Spider-Man Titan Hero Series Spider-Man 12"" Action Figure",19,Action Figures,14.89,"Very, Worth The Price!"
Tenozek Halloween Decoration Outdoor Yard Signs Stakes with 20g Cobwebs and 18 Pcs Small Spider Props Scary Zombie Vampire Graves for Outside Holiday,18,Outdoor Decor,16.52,Too scary...
"Marvel Spider-Man Maximum Venom, Venom Burst",18,Action Figures,29.99,Three toys in one
"Captain America & Spiderman Costumes - 2 Capes, 2 Masks w/Gift Box by Superheroes",4,Fancy-Dress Costumes,17.97,
Wireless Game Controller Compatible with PS4/Slim/Pro with Upgraded Joystick - Street Fire,1,Video Game Controllers,17.99,
"Spider-Man Short Sleeve Top & Pants, 2-Piece Pajama Set",20,Pajamas,22.48,Runs small.
Spiderman Adult Fabric Mask,1,Fancy-Dress Costumes,22.99,
"Marvel Spidey and His Amazing Friends Green Goblin Hero Figure, 4-Inch Scale Action Figure",10,Action Figures,22.99,Super cute.
Spider-Man: Far From Home Stealth Suit Spider-Man includes Claw Accessory,2,Action Figures,24.95,
"Squishmallows 5"" Ghost Spider Marvel Plush",0,Stuffed Animals & Plush Toys,13,
Alex Cross Novels: Along Came a Spider (Series #1) (Hardcover),20,Books,26.36,This is the first Alex...
Marvel Avengers Infinity War Iron Spider with Infinity Stone Accessory,1,Action Figures,28.99,
Garhelper Spider-Man Max Carnage Maximum Venom Carnage Figure Toy For Kids,0,Action Figures,,
Women Sexy Spiderman Party Costume Jumpsuit Dress Superhero Bodysuit,2,Fancy-Dress Costumes,27.99,
"Hasbro Marvel Legends Series 6-inch Scale Action Figure Toy Web-Man, Includes Premium Design, and 2 Accessories",1,Action Figures,32.88,
Spider-Man Titan Hero Series Web Warriors Armored Spider-Man Action Figure,10,Action Figures,31.34,
Spider-Man: Far From Home / Spider-Man: Homecoming (4K Ultra HD),0,Movies,30.4,
Rubie'S Iron Spider Avenger Deluxe Child Large Halloween Costume,0,Fancy-Dress Costumes,44.51,
Activision The Amazing Spiderman 2 (Wii U),3,Video Games,39.99,
"The Toy Express Spiderman Birthday Party Supplies Set - Includes Dinner Plates, Cake Plates, Napkins and Cups (Standard - Serves 16)",0,Party Supply Sets,39.99,
Spider-Man: Into the Spider-Verse Nerf Miles Morales Assembler Gear,3,Blasters & Foam Play,47.98,
Spider-Man Loot Bags [8 Per Pack],1,Party Bags,3.99,
Spider & Insect Glue Trap - 4 Professional Strength Traps per Package,3,"Pest Bait, Traps & Killers",5.68,
Yellies! Wiggly Wriggles; Voice-Activated Spider Pet; Ages 5 and up,1,Electronic Pets,7.36,
"Spider plant, Chlorophytum comosum, limited, in a 2 inch pot super cute",1,Live Plants,7.99,
Miles Morales: Spider-Man (Paperback),3,Books,8.29,I loved this! Even tho...
Yellies! Fuzzbo; Voice-Activated Spider Pet; Ages 5 and up,3,Electronic Pets,9.29,
Marvel Ultimate Spider-Man Titan Hero Series Spider-Man 2099 Figure,1,Action Figures,9.79,
Burn After Writing (Spiders) (Paperback),0,Books,10.86,
"WAY TO CELEBRATE! Polyester Spider Halloween Dog & Cat Costume, Brown, M",0,Pet Apparel,11.97,
"Spiderman, Superheroes, Cosplay, Adult, Children, Kids Costume, Halloween",0,Fancy-Dress Costumes,11.99,
"Mighty Marvel Masterworks: The Amazing Spider-Man, Vol. 3 : The Goblin and the Gangsters (Paperback)",0,Books,11.99,
Magnetic Hardcover: Marvel's Super Hero Adventures Spider-Man: A Tangled Web (Hardcover),0,Books,12.14,
Marvel Spider-Man: Far From Home Titan Hero Series Spider-Man 12-Inch Action Figure,2,Action Figures,12.95,
"1000 sqft Spider Webs Halloween Decorations + Free 100 Fake Spiders, Super Stretch Cobwebs for Scary Halloween Indoor and Outdoor Party Props Supplies",1,Decoration,12.99,
"Willstar 275"" Halloween Spider Web + 12"" Giant Spider Decorations Fake Spider with Triangular Huge Spider Web for Indoor Outdoor Halloween Decorations Yard Home Costumes Parties Haunted House Décor",1,Decoration,13.49,
LEGO Marvel Spiderman Far From Home Minifigure - Spider-Man (with Web Accessory 🕸 ),0,Interlocking Block Building Sets,13.95,
"Marvel Spider-Man Titan Hero Series Spider-Man 12"" Action Figure",19,Action Figures,14.89,"Very, Worth The Price!"
Spider-Man: Avenging Spider-Man (DVD),1,Movies,15.49,
5 Pcs Realistic Hairy Halloween Spider Decorations,0,Outdoor Decor,17.09,
Spider-Man 6-inch Spider-Girl Figure,0,Action Figures,17.99,
Wupuaait RC Climbing Spider Robot Toys Scary Trick Electronic Spider for 3-12 Years Old Kids,1,Novelty & Gag Toys,19.99,
"Ortho Home Defense Insect Killer for Lawn & Landscape Concentrate, 32 Oz.",47,"Pest Bait, Traps & Killers",20.74,Home Defense for Inscects
"BRIKSMAX LED Lighting Kit for Spider-ManVenom, Light Set Compatible with Legos 76187 Building Blocks Model (Not Include the Building Set)",24,Interlocking Block Building Sets,22.49,LIGHTAILING Light Set for (Architecture San Francisco) Building Blocks Model
"Happylost Ultrasonic Pest Repeller, 6 Packs, Electronic Indoor Pest Repellent for Mosquito,Mice,Roach,Spider,Insects",376,Insect & Pest Repellent,16.61,Amazing Product!
Marvel Spider-Verse Miles Morales Toddler Boys Zip Up Cosplay Costume Coverall Black 2T,3,Fancy-Dress Costumes,24.99,
Spider-Man: No Way Home [DVD] [2021] NEW** FREE SHIPPING!!!,0,Movies,25.99,
Rise of theTeenage Mutant Ninja Turtle Spider Shell Donatello Action Figure,0,Action Figures,29.39,
Roach Killer & Ant Killer - 6 Pack - Contact And Residual Kill Fleas Spiders Spray Can 3 Oz,0,"Pest Bait, Traps & Killers",31,
"Ortho Home Defense Max Indoor Insect Barrier: Starts to Kill Ants, Roaches, Spiders, Fleas & Ticks Fast, 1 gal.",0,"Pest Bait, Traps & Killers",31.84,
"Asdomo Legend Series Spider-Man Venom titan Action Figure Collectible Toy gift 7""",0,Action Figures,34.06,
"Rubie's Iron Spider Avenger Deluxe Boy's Halloween Fancy-Dress Costume, S",0,Fancy-Dress Costumes,38.24,
Activision Amazing Spiderman 2 for Nintendo 3DS,4,Video Games,40.88,
Iron Spider Deluxe Muscle Chest Kids Costume,2,Fancy-Dress Costumes,44.99,
Cosplay Life Miles Morales - Into The Spider-Verse Black Spider-Man Suit w/ Detachable Mask and Lens (L),2,Fancy-Dress Costumes,45.99,
Boys Spiderman Venom Reversible Costume,0,Fancy-Dress Costumes,47.18,
Spider-Man Maximum Venom Titan Hero Spider-Man Vs. Venom Action Figure,20,Action Figures,49.99,Highly recommend
"Marvel E5864 Spiderman Titan Hero Series Including 12"" Spider-Man, Spider-Girl, Miles Morales and Scarlet Spider",0,Action Figures,62.9,
"Spider-Man: Miles Morales, Sony, PlayStation 5",0,Video Games,79.88,
The Amazing Spider-man (Xbpx 360),6,Video Games,79.96,If your little guy likes Spiderman...
Disneyland Avengers Campus Spider-Man Web Shooters Set Of 2 with Display Stand,0,Fancy-Dress Costumes,124.97,
Flower Plant Insect Spray Potted Plant Insect Spider Spray,0,"Pest Bait, Traps & Killers",6.58,
"Marvel Spiderman Mavel Surprise Chalk, 3 Piece Sidewalk Chalk with Toy Surprise (SM00679)",0,Party Favors,6.99,
Way To Celebrate Halloween Spider Jewelry  Set Adult One Size Silver And Blue,13,Costume Accessories,7.08,Yes please
Ghostwalker Novel: Spider Game (Other),2,Books,7.99,
World of Eric Carle: The Very Busy Spider : A Lift-The-Flap Book (Book),26,Books,7.99,A spider cant be both...
The Grouchy Ladybug Board Book (Board book),33,Books,8.99,"Nice Book-sturdy, should last"
Halloween 9.85 Ft Giant Round Spider Web Outdoor Halloween Decorations Costume Party Garden Yard Haunted House Décor(Black),0,Fancy-Dress Costumes,10.79,
The Girl in the Spider's Web: A New Dragon Tattoo Story (Blu-ray + DVD),9,Movies,11.86,
Marvel Spider-Man: Far From Home Titan Hero Series Spider-Man 12-Inch Action Figure,2,Action Figures,12.95,
"PVUEL 4 Pcs Ultrasonic Pest Repeller, Indoor Dust Mite Killer Pest Bed Bug Repellent for Bug Rat Spider Roaches",1,Insect & Pest Repellent,13.36,
Spider-Man: Homecoming (Blu-ray + Blu-ray),0,Movies,13.99,
Alex Cross Novels: Along Came a Spider (Series #1) (Paperback),21,Books,14.54,Patterson  books
Super Hero Action Figures Toys with Light Music Collectible Model Boys Toy Gifts Spider Man,0,Action Figures,14.41,
Halloween Giant Large Huge Spider/Web Props Outdoor Yard Decor Scary Decorations,0,Decoration,15.99,
